id,gender,masterCategory,subCategory,articleType,baseColour,season,year,usage,productDisplayName
4850,Men,Apparel,Topwear,Tshirts,Brown,Summer,2011.0,Sports,ADIDAS Men's Edge  Brown Polo T-shirt
23159,Men,Apparel,Topwear,Tshirts,Charcoal,Fall,2011.0,Casual,Mark Taylor Men Charcoal Printed T-shirt
9773,Men,Apparel,Bottomwear,Shorts,Blue,Fall,2011.0,Casual,ADIDAS Men Gfx Re V 2L Sho Blue Shorts
48454,Men,Apparel,Topwear,Tshirts,White,Summer,2012.0,Casual,French Connection Men White Printed T-shirt
23965,Men,Apparel,Topwear,Tshirts,Green,Fall,2011.0,Casual,Peter England Men Green Printed T-shirt
18324,Men,Apparel,Topwear,Shirts,Navy Blue,Fall,2011.0,Casual,Wills Lifestyle Men Check Navy Blue Shirt
38982,Men,Apparel,Topwear,Shirts,Green,Summer,2012.0,Formal,Arrow Men Green Striped Shirt
20141,Men,Apparel,Topwear,Shirts,Navy Blue,Fall,2011.0,Casual,Wrangler Men Authentic Rope Navy Blue Shirt
47281,Men,Apparel,Topwear,Tshirts,Yellow,Summer,2012.0,Casual,Myntra Men Pack of 3 T-shirts
16423,Men,Apparel,Topwear,Tshirts,Grey,Fall,2011.0,Casual,Levi's Men Printed Grey Tshirts
8800,Men,Apparel,Topwear,Shirts,Purple,Fall,2011.0,Casual,Scullers Men Scul Purple White Shirts
22616,Men,Apparel,Topwear,Tshirts,Red,Summer,2011.0,Casual,Nike Men Red T-shirt
46353,Men,Apparel,Topwear,Shirts,Blue,Summer,2012.0,Casual,Locomotive Men Blue Striped Shirt
27364,Men,Apparel,Topwear,Tshirts,Mustard,Fall,2011.0,Casual,Tantra Men Digi Skull Mustard T-shirt
13151,Men,Apparel,Topwear,Tshirts,Blue,Fall,2011.0,Casual,Puma Men Jersey Blue Polo Tshirts
7848,Men,Apparel,Topwear,Tshirts,Orange,Fall,2011.0,Casual,Proline Men Printed T-shirt
16611,Men,Apparel,Bottomwear,Trousers,Black,Fall,2011.0,Formal,Genesis Men Stripes Black Trousers
26084,Men,Apparel,Topwear,Shirts,Yellow,Summer,2012.0,Formal,John Miller Men Check Yellow Shirt
44636,Men,Apparel,Topwear,Tshirts,White,Summer,2012.0,Casual,Nike Men White Printed T-shirt
16275,Men,Apparel,Topwear,Sweatshirts,Black,Fall,2011.0,Casual,Free Authority Men Stripes Purple Sweatshirts
31457,Men,Apparel,Bottomwear,Shorts,Black,Summer,2012.0,Sports,Nike Men Running Black Shorts
3282,Men,Apparel,Topwear,Tshirts,Purple,Summer,2011.0,Casual,Guerrilla Men's Army Of God Purple T-shirt
30585,Men,Apparel,Topwear,Tshirts,Black,Fall,2012.0,Casual,Nike Men Club Pique Polo Black T-shirt
2350,Men,Apparel,Topwear,Tshirts,White,Fall,2010.0,Casual,Reebok Men Audi White T-shirt
27532,Men,Apparel,Topwear,Shirts,Blue,Summer,2012.0,Casual,Scullers Men Check Blue Shirt
13707,Men,Apparel,Topwear,Tshirts,Red,Fall,2011.0,Casual,Proline Mens Solid Red Polo Tshirt
5949,Men,Apparel,Topwear,Shirts,Red,Summer,2011.0,Casual,Locomotive Men Bold Red White Checked Shirt
33300,Men,Apparel,Bottomwear,Trousers,White,Summer,2012.0,Casual,Arrow Sport Men White Trousers
11050,Men,Apparel,Topwear,Shirts,Red,Fall,2011.0,Casual,Scullers Men Check Red Shirts
14522,Men,Apparel,Topwear,Shirts,Olive,Fall,2011.0,Formal,Mark Taylor Men Light Brown & White Striped Shirt
11262,Men,Apparel,Bottomwear,Trousers,Beige,Fall,2011.0,Casual,Indigo Nation Men TR Yarn Dyed Beige Trousers
4295,Men,Apparel,Topwear,Tshirts,Orange,Summer,2011.0,Casual,Tantra   T-shirt
16047,Men,Apparel,Topwear,Shirts,Maroon,Fall,2011.0,Casual,Highlander Men Check Maroon Slim Fit Shirt
19833,Men,Apparel,Topwear,Shirts,Blue,Fall,2011.0,Casual,U.S. Polo Assn. Men Solid Blue Shirt
34317,Men,Apparel,Topwear,Tshirts,Red,Summer,2012.0,Casual,Myntra Men Red Freedom Warior T-shirt
17195,Men,Apparel,Topwear,Sweaters,Green,Winter,2016.0,Casual,U.S. Polo Assn. Men Stripes Green Sweater
2162,Men,Apparel,Topwear,Shirts,Blue,Spring,2011.0,Casual,Probase Men Blue Slim Fit Solid Casual Shirt
16281,Men,Apparel,Topwear,Sweatshirts,Grey,Fall,2011.0,Casual,Batman Men Batman Grey Sweatshirts
23166,Men,Apparel,Topwear,Tshirts,Red,Fall,2011.0,Casual,Mark Taylor Men Red Printed T-shirt
12621,Men,Apparel,Topwear,Tshirts,Grey,Fall,2011.0,Casual,Probase Men Printed Grey Tshirts
26414,Men,Apparel,Topwear,Shirts,Green,Summer,2012.0,Casual,Turtle Men Check Green Shirt
3276,Men,Apparel,Topwear,Tshirts,Brown,Summer,2011.0,Casual,Guerrilla Men's Wanted Coffee T-shirt
24343,Men,Apparel,Topwear,Tshirts,White,Summer,2012.0,Casual,ADIDAS Men White Printed T-shirt
37754,Men,Apparel,Topwear,Shirts,Blue,Summer,2012.0,Casual,John Players Men Striped Blue Shirt
5181,Men,Apparel,Topwear,Tshirts,Grey,Summer,2011.0,Casual,Jimi Hendrix Men's Pop Festival Dark Grey T-shirt
53211,Men,Apparel,Topwear,Shirts,Blue,Summer,2012.0,Formal,Mark Taylor Men Blue Shirt
4053,Men,Apparel,Topwear,Tshirts,White,Summer,2011.0,Casual,Myntra Men's Eagle Emblem White T-shirt
10344,Men,Apparel,Topwear,Tshirts,Purple,Fall,2011.0,Casual,United Colors of Benetton Men Solid Purple Tshirts
11296,Men,Apparel,Bottomwear,Jeans,Blue,Fall,2011.0,Casual,Wrangler Men Blue Custom Jeans
4261,Men,Apparel,Topwear,Tshirts,White,Summer,2011.0,Casual,Inkfruit Men's The Last Drumer White UV T-shirt
21403,Men,Apparel,Topwear,Tshirts,Grey,Fall,2011.0,Casual,Locomotive Men Printed Grey T-shirt
15636,Men,Apparel,Topwear,Tshirts,Navy Blue,Fall,2011.0,Casual,Nike Men AS Airtight Navy Blue Tshirts
3878,Men,Apparel,Topwear,Tshirts,Black,Summer,2011.0,Casual,Wrangler Men's Reverse Print Charcoal T-shirt
18915,Men,Apparel,Topwear,Shirts,Red,Fall,2011.0,Casual,Levis Men Work Western Red Shirt
6536,Men,Apparel,Bottomwear,Shorts,Black,Summer,2011.0,Sports,Nike Men's Trophy Woven Black Short
17161,Men,Apparel,Topwear,Shirts,Purple,Fall,2011.0,Casual,U.S. Polo Assn. Men Checks Purple Shirt
3044,Men,Apparel,Topwear,Tshirts,Blue,Summer,2011.0,Casual,Tantra Men's Freddie Blue T-shirt
30743,Men,Apparel,Topwear,Kurtas,White,Summer,2012.0,Ethnic,Fabindia Men Striped White Kurta
40050,Men,Apparel,Topwear,Jackets,Yellow,Summer,2012.0,Casual,ADIDAS Men Yellow Kaka Jacket
10720,Men,Apparel,Bottomwear,Shorts,White,Summer,2011.0,Sports,Nike Men Ftbll/Socc shorts White Shorts
37102,Men,Apparel,Bottomwear,Trousers,Grey,Summer,2012.0,Formal,Wills Lifestyle Men Grey Trousers
13999,Men,Apparel,Topwear,Sweatshirts,Black,Fall,2011.0,Sports,Nike Men Solid Black Jackets
17505,Men,Apparel,Topwear,Tshirts,White,Fall,2011.0,Casual,Classic Polo Men Stripes White Polo T-Shirt
30327,Men,Apparel,Topwear,Tshirts,Black,Summer,2012.0,Casual,Myntra Men Revolves Black T-shirt
3420,Men,Apparel,Topwear,Tshirts,Black,Summer,2011.0,Casual,Myntra Men's Chai Garam Black T-shirt
13397,Men,Apparel,Topwear,Shirts,Purple,Summer,2011.0,Casual,United Colors of Benetton Men Check Purple Shirts
12245,Men,Apparel,Topwear,Shirts,Maroon,Winter,2011.0,Formal,Genesis Maroon Formal Shirt
3612,Men,Apparel,Topwear,Tshirts,Grey,Summer,2011.0,Sports,Puma Men's Deccan Chargers It Grows on You Grey T-shirt
40262,Men,Apparel,Topwear,Shirts,White,Summer,2012.0,Casual,Scullers Men White & Blue Check Shirt
5985,Men,Apparel,Topwear,Shirts,Green,Summer,2011.0,Casual,Highlander Men Green Black Checked Slim Fit Shirt
4857,Men,Apparel,Topwear,Tshirts,Red,Summer,2011.0,Sports,Nike Men Arsenal Red Jersey
12619,Men,Apparel,Topwear,Tshirts,Grey,Fall,2011.0,Casual,Probase Men Printed Grey Tshirts
18323,Men,Apparel,Topwear,Shirts,Green,Fall,2011.0,Casual,Wills Lifestyle Men Check Green Shirt
23962,Men,Apparel,Topwear,Jackets,Grey,Fall,2011.0,Casual,Provogue Men Grey Sleeveless Jacket
48453,Men,Apparel,Topwear,Tshirts,White,Summer,2012.0,Casual,French Connection Men White Printed T-shirt
9774,Men,Apparel,Topwear,Tshirts,White,Fall,2011.0,Casual,ADIDAS Men Co Graphic White Tshirts
17159,Men,Apparel,Topwear,Shirts,Blue,Fall,2011.0,Casual,U.S. Polo Assn. Men Checks Blue Shirt
9546,Men,Apparel,Topwear,Tshirts,Purple,Fall,2011.0,Sports,Nike Men As Elite Ultimate Ss Training Purple T-Shirts
44890,Men,Apparel,Topwear,Tshirts,Navy Blue,Summer,2012.0,Casual,Puma Men Navy Blue Polo T-shirt
24149,Men,Apparel,Topwear,Tshirts,Blue,Spring,2012.0,Casual,ADIDAS Men Blue T-shirt
4259,Men,Apparel,Topwear,Tshirts,Grey,Summer,2011.0,Casual,Inkfruit Men's Uni Grey T-shirt
18575,Men,Apparel,Topwear,Tshirts,White,Fall,2011.0,Casual,Puma Men Ghetto Halftone White T-shirt
6956,Men,Apparel,Topwear,Shirts,White,Summer,2011.0,Casual,s.Oliver Men White Shirt
7884,Men,Apparel,Bottomwear,Track Pants,Black,Fall,2011.0,Casual,Proline Men Black Track Pants
3418,Men,Apparel,Topwear,Tshirts,Black,Summer,2011.0,Casual,Myntra Men's Take my advice
32448,Men,Apparel,Bottomwear,Shorts,Navy Blue,Summer,2012.0,Sports,ADIDAS Men Navy Blue 3/4 Length Pants
40068,Men,Apparel,Bottomwear,Shorts,Black,Summer,2012.0,Casual,ADIDAS Men Black Shorts
9310,Men,Apparel,Topwear,Tshirts,Maroon,Fall,2011.0,Casual,Indian Terrain Men Riley Maroon T-shirt
19695,Men,Apparel,Topwear,Shirts,Navy Blue,Fall,2011.0,Casual,United Colors of Benetton Men Check Navy Blue Shirt
26048,Men,Apparel,Topwear,Shirts,Grey,Summer,2012.0,Formal,John Miller Men Grey Shirt
13955,Men,Apparel,Topwear,Tshirts,White,Summer,2011.0,Casual,United Colors of Benetton Men Printed White Tshirts
8838,Men,Apparel,Bottomwear,Trousers,Beige,Summer,2011.0,Casual,Scullers Men Scul Beige Trousers
7870,Men,Apparel,Topwear,Tshirts,Purple,Fall,2011.0,Casual,Proline Men Purple Polo T-shirt
19453,Men,Apparel,Topwear,Tshirts,Purple,Fall,2011.0,Casual,Quiksilver Men Purple Printed T-shirt
31239,Men,Apparel,Topwear,Tshirts,Red,Summer,2012.0,Casual,Puma Men Reisen Polo Red T-shirt
8004,Men,Apparel,Topwear,Tshirts,Black,Fall,2011.0,Sports,Fila Men's Round Neck Black Grey T-shirt
20179,Men,Apparel,Topwear,Shirts,Green,Fall,2011.0,Casual,Wrangler Men Rodeo Green Shirt
14942,Men,Apparel,Topwear,Tshirts,Black,Fall,2011.0,Casual,Status Quo Men Stripes Black Tshirts
16629,Men,Apparel,Topwear,Tshirts,Black,Summer,2016.0,Casual,Facit Men Black Printed T-shirt
19661,Men,Apparel,Topwear,Sweatshirts,Black,Fall,2011.0,Casual,United Colors of Benetton Men Printed Black Sweatshirt
12289,Men,Apparel,Bottomwear,Trousers,Black,Fall,2011.0,Formal,Genesis Men Solid Black Trousers
5971,Men,Apparel,Topwear,Shirts,Blue,Summer,2011.0,Casual,Locomotive Men Blue Black Grey Checked Shirt
37798,Men,Apparel,Topwear,Shirts,White,Summer,2012.0,Formal,John Players Men Striped White Shirt
28542,Men,Apparel,Topwear,Tshirts,Grey,Summer,2012.0,Casual,Nike Men Bold Striped Grey T-shirt
9780,Men,Apparel,Topwear,Tshirts,Grey,Fall,2011.0,Casual,ADIDAS Men Grey Polo Tshirts
3088,Men,Apparel,Topwear,Tshirts,Grey,Summer,2011.0,Casual,Probase Men's Dreams Future Grey T-shirt
44864,Men,Apparel,Topwear,Tshirts,Blue,Summer,2012.0,Casual,Puma Men Blue & White T-shirt
14728,Men,Apparel,Topwear,Tshirts,Brown,Fall,2011.0,Casual,Ed Hardy Men Dog Print Brown Tshirts
33936,Men,Apparel,Topwear,Tshirts,White,Summer,2012.0,Casual,ADIDAS Men Clima White T-shirt
13390,Men,Apparel,Topwear,Shirts,Blue,Summer,2011.0,Casual,United Colors of Benetton Men Check Blue Shirts
30112,Men,Apparel,Topwear,Shirts,Blue,Summer,2012.0,Casual,Flying Machine Men Check Blue Shirt
26077,Men,Apparel,Topwear,Shirts,Pink,Summer,2012.0,Formal,John Miller Men Check Pink Shirt
12242,Men,Apparel,Topwear,Shirts,White,Fall,2011.0,Formal,Genesis Men White Shirt
32645,Men,Apparel,Bottomwear,Track Pants,Navy Blue,Summer,2012.0,Sports,Nike Men Knit Navy Blue Track Pants
40265,Men,Apparel,Topwear,Tshirts,Purple,Summer,2012.0,Casual,Scullers Men Purple T-shirt
14989,Men,Apparel,Topwear,Sweatshirts,Blue,Fall,2011.0,Casual,ADIDAS Men Solid Aqua Blue Sweatshirts
32477,Men,Apparel,Topwear,Tshirts,White,Summer,2012.0,Casual,Proline Men White T-shirt
40057,Men,Apparel,Topwear,Tshirts,Blue,Summer,2012.0,Casual,ADIDAS Men Blue Printed T-shirt
38971,Men,Apparel,Topwear,Tshirts,Grey,Summer,2012.0,Casual,Arrow New York Men Grey T-shirt
17502,Men,Apparel,Topwear,Tshirts,Mustard,Fall,2011.0,Casual,Classic Polo Men Stripes Yellow Polo T-Shirt
6155,Men,Apparel,Topwear,Tshirts,Orange,Summer,2011.0,Casual,Lee Men's March Burnt Orange T-shirt
30320,Men,Apparel,Topwear,Tshirts,Teal,Summer,2012.0,Casual,Myntra Men Teal T-shirt
3427,Men,Apparel,Topwear,Tshirts,Black,Summer,2011.0,Casual,Myntra Men's I Have Healing Hand Black T-shirt
11291,Men,Apparel,Bottomwear,Jeans,Blue,Summer,2016.0,Casual,Wrangler Men Blue Millard Jeans
15631,Men,Apparel,Bottomwear,Track Pants,Navy Blue,Winter,2014.0,Sports,Nike Men Navy Cricket Track Pants
21404,Men,Apparel,Topwear,Tshirts,White,Fall,2011.0,Casual,Locomotive Men Printed White T-shirt
29669,Men,Apparel,Topwear,Shirts,White,Summer,2012.0,Casual,Indigo Nation Men Printed White Shirt
17166,Men,Apparel,Topwear,Shirts,Maroon,Fall,2011.0,Casual,U.S. Polo Assn. Men Checks Maroon Shirt
18912,Men,Apparel,Topwear,Shirts,Red,Fall,2011.0,Casual,Levis Men Classics Formula One Red Shirt
2191,Men,Apparel,Bottomwear,Shorts,Blue,Fall,2010.0,Sports,ADIDAS Men Chelsea Lead Short
30744,Men,Apparel,Topwear,Kurtas,Blue,Summer,2012.0,Ethnic,Fabindia Men Blue Printed Kurta
16286,Men,Apparel,Topwear,Tshirts,Green,Fall,2011.0,Casual,Peter England Men Printed Green TShirt
23161,Men,Apparel,Topwear,Tshirts,Navy Blue,Fall,2011.0,Casual,Mark Taylor Men Navy Blue Printed T-shirt
3271,Men,Apparel,Topwear,Tshirts,Red,Summer,2011.0,Casual,Guerrilla Men's Poison Blood Red T-shirt
12626,Men,Apparel,Topwear,Tshirts,Navy Blue,Fall,2011.0,Casual,Probase Men Printed Navy Blue Tshirts
24344,Men,Apparel,Topwear,Tshirts,Blue,Fall,2011.0,Sports,ADIDAS Men Blue T-shirt
4868,Men,Apparel,Topwear,Tshirts,Orange,Summer,2016.0,Casual,Levis Kids Boy's Darby Orange Polo Tshirt
37753,Men,Apparel,Topwear,Shirts,Blue,Summer,2012.0,Casual,John Players Men Stripes Blue Shirt
5186,Men,Apparel,Topwear,Tshirts,Black,Summer,2011.0,Casual,Dark Knight Men's Joker Color Splash Black T-shirt
4054,Men,Apparel,Topwear,Tshirts,Black,Summer,2011.0,Casual,Myntra Men's Hard Work Never Killed Anyone Black T-shirt
11265,Men,Apparel,Bottomwear,Trousers,Black,Fall,2011.0,Casual,Indigo Nation Men TR Yarn Dyed Black Trousers
4292,Men,Apparel,Topwear,Tshirts,Black,Summer,2011.0,Casual,Tantra Men's Shanti Black T-shirt
19834,Men,Apparel,Topwear,Shirts,Blue,Winter,2012.0,Casual,U.S. Polo Assn. Men Blue Checked Shirt
17192,Men,Apparel,Topwear,Shirts,Maroon,Winter,2016.0,Casual,U.S. Polo Assn. Men Stripes Maroon Shirt
31662,Men,Apparel,Topwear,Shirts,Green,Summer,2012.0,Casual,Indigo Nation Men Printed Teal Shirt
2165,Men,Apparel,Topwear,Shirts,Blue,Summer,2011.0,Casual,Probase Men Check Blue Shirt
16272,Men,Apparel,Topwear,Shirts,Red,Fall,2011.0,Casual,Levis Men Red & White Striped Shirt
23195,Men,Apparel,Topwear,Shirts,Green,Fall,2011.0,Casual,Highlander Men Green Striped Shirt
31450,Men,Apparel,Topwear,Tshirts,Blue,Summer,2013.0,Sports,Nike Men Blue Sleeveless T-Shirt
3285,Men,Apparel,Topwear,Tshirts,Yellow,Summer,2011.0,Casual,Guerrilla Men's Move It Move On Green T-shirt
10185,Men,Apparel,Topwear,Shirts,White,Fall,2011.0,Casual,Indigo Nation Men Price catch White Shirts
11057,Men,Apparel,Topwear,Shirts,Purple,Fall,2011.0,Casual,Scullers Men Check Purple Shirt
16616,Men,Apparel,Topwear,Shirts,Green,Fall,2011.0,Casual,Probase Men Stripes Green Shirt
27151,Men,Apparel,Topwear,Shirts,Blue,Summer,2012.0,Formal,Mark Taylor Men Striped Blue Shirt
28925,Men,Apparel,Topwear,Tshirts,Blue,Summer,2012.0,Casual,Mr. Men Printed Blue T-shirt
8209,Men,Apparel,Topwear,Tshirts,Grey,Summer,2011.0,Casual,Locomotive Men Stripe Lann Grey T-Shirts
26083,Men,Apparel,Topwear,Shirts,Yellow,Summer,2012.0,Formal,John Miller Men Striped Yellow Shirt
44631,Men,Apparel,Bottomwear,Track Pants,Black,Summer,2012.0,Sports,Nike Men Black Track Pants
5516,Men,Apparel,Topwear,Tshirts,White,Summer,2011.0,Casual,Probase Men's Crack Print Crew Challenger White T-shirt
33551,Men,Apparel,Topwear,Shirts,Blue,Summer,2012.0,Casual,Wrangler Men Atlanta Dark Base Striped Blue Shirt
20146,Men,Apparel,Topwear,Shirts,Navy Blue,Fall,2011.0,Casual,Wrangler Men Urban Navy Blue Shirt
22611,Men,Apparel,Topwear,Tshirts,Green,Fall,2011.0,Sports,Nike Men Green Jersey
16424,Men,Apparel,Topwear,Tshirts,Blue,Fall,2011.0,Casual,Levi's Men Printed Blue  Tshirts
8807,Men,Apparel,Topwear,Shirts,Green,Fall,2011.0,Casual,Scullers Men Scul Black & Green Check Shirt
13156,Men,Apparel,Topwear,Tshirts,Green,Fall,2011.0,Casual,Puma Men Jersey Green Polo Tshirts
6721,Men,Apparel,Topwear,Tshirts,White,Summer,2011.0,Casual,Locomotive Men's Fateeion White T-shirt
9769,Men,Apparel,Bottomwear,Tracksuits,Navy Blue,Fall,2011.0,Casual,ADIDAS Men Navy Blue Tracksuit
42174,Men,Apparel,Topwear,Tshirts,Blue,Summer,2017.0,Casual,Status Quo Men Blue T-shirt
32203,Men,Apparel,Topwear,Kurtas,Blue,Summer,2012.0,Ethnic,Fabindia Men Printed Blue Kurta
11081,Men,Apparel,Topwear,Shirts,Red,Fall,2011.0,Casual,Scullers Men Check Red Shirts
5998,Men,Apparel,Topwear,Shirts,Blue,Summer,2011.0,Casual,Highlander Men Blue Red Plaid Checked Shirt
37771,Men,Apparel,Topwear,Shirts,Yellow,Summer,2012.0,Casual,John Players Men Gingham Yellow Shirt
10361,Men,Apparel,Topwear,Tshirts,Purple,Fall,2011.0,Casual,United Colors of Benetton Men Graphic Printed Purple Tshirts
4244,Men,Apparel,Topwear,Tshirts,Navy Blue,Summer,2011.0,Casual,Probase Men's Against All Odds Navy T-shirt
15613,Men,Apparel,Bottomwear,Shorts,Black,Fall,2011.0,Sports,Nike Men Runng Black Shorts
18930,Men,Apparel,Topwear,Tshirts,Red,Fall,2011.0,Casual,Levi's Men Graphic Print Red Tshirt
28799,Men,Apparel,Bottomwear,Jeans,Blue,Summer,2012.0,Casual,Denizen Men Blue Jeans
30766,Men,Apparel,Topwear,Kurtas,Blue,Summer,2012.0,Ethnic,Fabindia Men Blue Matka Silk Kurta
3061,Men,Apparel,Topwear,Tshirts,Yellow,Summer,2011.0,Casual,Tantra Men's E BO Yellow T-shirt
33587,Men,Apparel,Topwear,Tshirts,Purple,Summer,2012.0,Casual,Wrangler Men Pixelate Poster Purple T-shirt
40075,Men,Apparel,Topwear,Tshirts,Black,Summer,2012.0,Sports,ADIDAS Men Black Jersey
32455,Men,Apparel,Topwear,Tshirts,White,Summer,2012.0,Casual,ADIDAS Men Polo White T-shirt
20190,Men,Apparel,Topwear,Tshirts,Blue,Fall,2011.0,Casual,Wrangler Men Broad Blue T-shirt
46382,Men,Apparel,Topwear,Tshirts,Blue,Summer,2012.0,Casual,ADIDAS Men Blue Printed T-shirt
6177,Men,Apparel,Topwear,Tshirts,Blue,Summer,2011.0,Casual,Lee Men's Cosmos Blue Lapis T-shirt
9903,Men,Apparel,Bottomwear,Jeans,Blue,Fall,2011.0,Casual,Spykar Men Ep Skinny Low Waist Fit Blue Jeans
12052,Men,Apparel,Topwear,Tshirts,White,Fall,2011.0,Casual,Spykar Men White Polo T-Shirts
26267,Men,Apparel,Topwear,Tshirts,Purple,Summer,2013.0,Casual,Proline Men Purple Polo T-Shirt
30302,Men,Apparel,Topwear,Tshirts,Off White,Summer,2012.0,Casual,Myntra Men Evil Minds Off White T-shirt
7297,Men,Apparel,Topwear,Tshirts,Brown,Fall,2011.0,Casual,Jimi Hendrix Men's Jimi Experience Brown Melange T-shirt
19688,Men,Apparel,Bottomwear,Shorts,Navy Blue,Fall,2011.0,Casual,United Colors of Benetton Men Navy Blue Check Shorts
12260,Men,Apparel,Topwear,Shirts,Blue,Winter,2011.0,Formal,Genesis Blue Striped Formal Shirt
26055,Men,Apparel,Topwear,Shirts,Blue,Summer,2012.0,Formal,John Miller Men Check Blue Shirt
29821,Men,Apparel,Topwear,Shirts,Green,Summer,2012.0,Casual,Basics Men Green Checked Shirt
27187,Men,Apparel,Topwear,Tshirts,Brown,Summer,2012.0,Casual,Mark Taylor Men Printed Brown T-shirt
41395,Men,Apparel,Topwear,Shirts,Red,Summer,2012.0,Casual,Wrangler Men Navy & Red Checked Slim Fit Casual Shirt
4412,Men,Apparel,Topwear,Tshirts,Black,Summer,2017.0,Casual,Pink Floyd Black Original Dark Side Black T-shirt
20958,Men,Apparel,Topwear,Tshirts,Grey,Fall,2011.0,Casual,s.Oliver Men Solid Grey Tshirt
40081,Men,Apparel,Topwear,Tshirts,White,Summer,2012.0,Sports,ADIDAS Men White & Green T-shirt
20164,Men,Apparel,Topwear,Shirts,Navy Blue,Fall,2011.0,Casual,Wrangler Men Easter Navy Blue Shirt
15283,Men,Apparel,Topwear,Tshirts,Blue,Fall,2011.0,Casual,Ed Hardy Men Eagle Print Blue Tshirts
16406,Men,Apparel,Topwear,Shirts,Maroon,Fall,2011.0,Casual,Levis Men Check Maroon Shirts
8825,Men,Apparel,Topwear,Shirts,White,Fall,2011.0,Casual,Spykar Men Ranger Blue-White Stripes Shirts
7051,Men,Apparel,Topwear,Shirts,Green,Summer,2011.0,Casual,s.Oliver Men Green White Check Shirt
46376,Men,Apparel,Topwear,Shirts,Black,Summer,2012.0,Casual,ADIDAS Men Black Shirt
6183,Men,Apparel,Topwear,Tshirts,Grey,Summer,2011.0,Casual,Lee Men's Striper Grey Orange T-shirt
26293,Men,Apparel,Topwear,Tshirts,Blue,Summer,2012.0,Casual,Proline Men Blue Striped Polo T-shirt
16634,Men,Apparel,Topwear,Tshirts,Green,Summer,2016.0,Casual,Facit Men Smart Green Tshirt
22401,Men,Apparel,Topwear,Shirts,White,Fall,2011.0,Casual,Mark Taylor Men Striped White Shirt
31016,Men,Apparel,Topwear,Shirts,White,Summer,2012.0,Formal,Arrow Men Striped White & Green Shirt
27173,Men,Apparel,Topwear,Shirts,Grey,Summer,2012.0,Formal,Mark Taylor Men Striped Grey Shirt
41361,Men,Apparel,Bottomwear,Jeans,Navy Blue,Spring,2013.0,Casual,Wrangler Men Navy Blue Floyd Jeans
11411,Men,Apparel,Topwear,Shirts,Olive,Fall,2011.0,Casual,United Colors of Benetton Men Olive Shirts
7607,Men,Apparel,Topwear,Tshirts,Black,Summer,2011.0,Casual,Nike Men's FCB Core Black SS T-shirt
43052,Men,Apparel,Bottomwear,Shorts,Navy Blue,Summer,2012.0,Casual,Nike Men Navy Blue Legacy Shorts
11075,Men,Apparel,Topwear,Sweaters,Blue,Fall,2011.0,Casual,Scullers Men Stripes Blue Sweaters
4082,Men,Apparel,Topwear,Tshirts,Beige,Summer,2011.0,Casual,Inkfruit Men's Avast Ye Beige T-shirt
37785,Men,Apparel,Topwear,Shirts,Blue,Summer,2012.0,Casual,John Players Men Gingham Blue Shirt
14507,Men,Apparel,Topwear,Tshirts,Black,Fall,2011.0,Sports,ADIDAS Men Solid Black Jerseys
44879,Men,Apparel,Topwear,Tshirts,Black,Summer,2012.0,Casual,Puma Men Black Polo neck T-shirt
14735,Men,Apparel,Topwear,Shirts,White,Fall,2011.0,Formal,Arrow Men Stripes White Shirts
34332,Men,Apparel,Topwear,Tshirts,Purple,Summer,2012.0,Casual,Myntra Men Purple T-shirt
16062,Men,Apparel,Bottomwear,Trousers,Navy Blue,Fall,2011.0,Casual,Highlander Men Solid Navy Blue Trouser
7435,Men,Apparel,Topwear,Tshirts,Red,Summer,2011.0,Casual,Proline Men Red & Navy Checked Polo T-shirt
19816,Men,Apparel,Topwear,Sweatshirts,Grey,Fall,2011.0,Casual,U.S. Polo Assn. Men Solid Grey Sweatshirt
13510,Men,Apparel,Topwear,Tshirts,Green,Fall,2011.0,Casual,Chimp Men Say Cheese Green Tshirts
2147,Men,Apparel,Topwear,Tshirts,Orange,Spring,2011.0,Casual,Basics Men Orange Striped Polo T-shirt
31640,Men,Apparel,Topwear,Shirts,Blue,Summer,2012.0,Casual,Indigo Nation Men Check Blue Shirt
3095,Men,Apparel,Topwear,Tshirts,Red,Summer,2011.0,Casual,Probase Men's Freestyler Red T-shirt
40278,Men,Apparel,Bottomwear,Trousers,Brown,Summer,2012.0,Casual,Scullers Men Brown Trousers
14994,Men,Apparel,Topwear,Sweaters,Black,Fall,2011.0,Casual,ADIDAS Men Check Black Sweaters
15846,Men,Apparel,Topwear,Tshirts,Grey,Fall,2011.0,Casual,Lee Grey Stripes Casual T-Shirts
29022,Men,Apparel,Topwear,Tshirts,White,Fall,2012.0,Casual,ADIDAS Men Aess Crew White T-shirt
26258,Men,Apparel,Bottomwear,Track Pants,Charcoal,Summer,2012.0,Sports,Proline Men Charcoal Grey Track Pants
6974,Men,Apparel,Topwear,Shirts,Blue,Summer,2011.0,Casual,s.Oliver Men White Stripe Blue Shirt
29674,Men,Apparel,Topwear,Shirts,Navy Blue,Summer,2012.0,Casual,Indigo Nation Navy Blue Shirt
3862,Men,Apparel,Topwear,Tshirts,Orange,Summer,2011.0,Casual,Wrangler Men's Authentic Embro Orange T-shirt
17947,Men,Apparel,Bottomwear,Track Pants,Blue,Fall,2011.0,Sports,Puma Men No. 1 logo Blue Track Pant
30759,Men,Apparel,Topwear,Kurtas,Black,Summer,2012.0,Ethnic,Fabindia Men Printed Black Kurta
4875,Men,Apparel,Topwear,Tshirts,Red,Summer,2016.0,Casual,Levis Kids Boy's Davis White Polo Tshirt
9756,Men,Apparel,Topwear,Tshirts,Maroon,Fall,2011.0,Casual,Classic Polo Men Ikon Maroon Polo Tshirts
2944,Men,Apparel,Topwear,Tshirts,White,Fall,2015.0,Casual,DUSG Men's Gorilla Organic Natural T-shirt
19829,Men,Apparel,Topwear,Shirts,Brown,Fall,2011.0,Casual,U.S. Polo Assn. Men Check Brown Shirt
9590,Men,Apparel,Topwear,Shirts,White,Fall,2011.0,Formal,Indigo Nation Men cotton White Shirts
11278,Men,Apparel,Topwear,Tshirts,Green,Fall,2011.0,Casual,Wrangler Men Celebrate Indigo Green Tshirts
39412,Men,Apparel,Topwear,Shirts,Orange,Summer,2014.0,Casual,U.S. Polo Assn. Orange Tailored Fit Striped Casual Shirt
44846,Men,Apparel,Topwear,Tshirts,Black,Summer,2012.0,Casual,Puma Men Black Ducati Graphic T-shirt
4881,Men,Apparel,Topwear,Tshirts,White,Summer,2016.0,Casual,Levis Kids Boy's Dustin White Black Kidswear
5953,Men,Apparel,Topwear,Shirts,Black,Summer,2011.0,Casual,Locomotive Men Plaid Black Checked Shirt
28560,Men,Apparel,Topwear,Tshirts,Black,Summer,2012.0,Casual,Nike Men Neon Black T-shirt
23188,Men,Apparel,Topwear,Shirts,Purple,Summer,2011.0,Casual,Highlander Men Purple Check Shirt
14960,Men,Apparel,Topwear,Jackets,Blue,Fall,2011.0,Casual,Status Quo Men Printed Blue Jackets
20369,Men,Apparel,Topwear,Shirts,Red,Summer,2011.0,Casual,United Colors of Benetton Men Check Red Shirt
1997,Men,Apparel,Bottomwear,Shorts,Grey,Fall,2010.0,Sports,Puma Men's Grey Sports Shorts
31029,Men,Apparel,Topwear,Shirts,Green,Summer,2012.0,Casual,Arrow New York Men Green Slim Fit Shirt
16439,Men,Apparel,Topwear,Tshirts,Red,Fall,2011.0,Casual,Levi's Men Printed Red Tshirts
8026,Men,Apparel,Bottomwear,Track Pants,Black,Fall,2011.0,Sports,Fila Men's Cont Pipping Cotton Lower Black White Track Pant
6980,Men,Apparel,Topwear,Shirts,Grey,Summer,2011.0,Casual,s.Oliver Men Grey White Check Shirt
39076,Men,Apparel,Topwear,Shirts,Navy Blue,Summer,2012.0,Casual,Arrow Sport Men Navy Blue Check Slim Fit Shirt
14732,Men,Apparel,Topwear,Shirts,Blue,Fall,2011.0,Formal,Arrow Men Stripes Blue Shirts
34335,Men,Apparel,Topwear,Tshirts,Lavender,Summer,2012.0,Casual,Myntra Men Lavender Printed T-shirt
7432,Men,Apparel,Bottomwear,Shorts,Grey,Summer,2011.0,Sports,Proline Men Grey Sports Short SS11/VSSHT02 VG/PC/JR
19811,Men,Apparel,Topwear,Sweatshirts,Black,Fall,2011.0,Casual,U.S. Polo Assn. Men Solid Black Sweatshirt
16065,Men,Apparel,Bottomwear,Trousers,Navy Blue,Fall,2011.0,Casual,Highlander Men Solid Blue Trouser
30795,Men,Apparel,Topwear,Shirts,Yellow,Summer,2012.0,Casual,Fabindia Men Striped Yellow Shirt
2140,Men,Apparel,Topwear,Tshirts,White,Spring,2011.0,Casual,Basics Men White T-shirt
