id,gender,masterCategory,subCategory,articleType,baseColour,season,year,usage,productDisplayName
29623,Men,Apparel,Topwear,Shirts,Lavender,Summer,2012.0,Formal,Indigo Nation Men Striped Lavender Shirt
18958,Men,Apparel,Topwear,Sweaters,Blue,Fall,2011.0,Casual,United Colors of Benetton Men Stripes Blue Sweater
48426,Men,Apparel,Topwear,Tshirts,White,Summer,2012.0,Casual,French Connection Men White Printed T-shirt
37719,Men,Apparel,Topwear,Tshirts,Blue,Summer,2012.0,Casual,John Players Men Polo Blue T-shirt
33943,Men,Apparel,Topwear,Tshirts,Blue,Summer,2012.0,Casual,ADIDAS Men Polo Blue T-Shirt
38597,Men,Apparel,Topwear,Tshirts,Grey,Summer,2012.0,Casual,Nike Men Printed Texture Grey T-shirt
28537,Men,Apparel,Topwear,Tshirts,Black,Summer,2012.0,Sports,Nike Men Challenger Black T-shirt
2779,Men,Apparel,Topwear,Tshirts,White,Summer,2011.0,Casual,Ediots   T-shirt
46910,Men,Apparel,Bottomwear,Jeans,Black,Summer,2012.0,Casual,Peter England Men Black Jeans
49958,Men,Apparel,Bottomwear,Shorts,Black,Summer,2016.0,Casual,Hanes Men Black Athletic 3/4th Pants
14937,Men,Apparel,Bottomwear,Shorts,Olive,Fall,2011.0,Casual,Status Quo Men Solid Olive Shorts
10799,Men,Apparel,Topwear,Shirts,Navy Blue,Fall,2011.0,Casual,Wrangler Men Wander Wheels Navy Blue Shirts
19426,Men,Apparel,Topwear,Shirts,Black,Summer,2012.0,Casual,Quiksilver Men Tar Pits Black Shirt
20791,Men,Apparel,Topwear,Jackets,Black,Fall,2011.0,Casual,Basics Men Black Blazer Jacket
37726,Men,Apparel,Topwear,Shirts,Blue,Summer,2012.0,Casual,John Players Men Soft Check Shirt
15476,Men,Apparel,Topwear,Tshirts,Black,Fall,2011.0,Casual,Puma Men Logo Black Tshirts
3204,Men,Apparel,Topwear,Tshirts,Blue,Summer,2011.0,Casual,Tantra Men's Arrest Sky Blue T-shirt
42123,Men,Apparel,Topwear,Tshirts,Navy Blue,Summer,2012.0,Sports,ADIDAS Men Navy Blue T-shirt
12653,Men,Apparel,Topwear,Tshirts,Grey,Fall,2011.0,Casual,Probase Men Printed Grey Tshirts
26466,Men,Apparel,Topwear,Tshirts,Green,Summer,2012.0,Casual,Puma Men Story Graphic Green T-shirt
13781,Men,Apparel,Bottomwear,Trousers,Grey,Fall,2011.0,Formal,Belmonte Men Solid Grey Trousers
48419,Men,Apparel,Topwear,Tshirts,Black,Summer,2012.0,Casual,French Connection Men Black Printed T-shirt
6776,Men,Apparel,Topwear,Tshirts,Red,Summer,2011.0,Casual,Timberland Men's Tipped Pique Polo Red T-shirt
34391,Men,Apparel,Topwear,Tshirts,Red,Summer,2012.0,Casual,Myntra Men Red Prayer T-shirt
15644,Men,Apparel,Bottomwear,Shorts,Navy Blue,Winter,2014.0,Sports,Nike Men As Df Crckt Navy Blue Shorts
41594,Men,Apparel,Topwear,Shirts,Grey,Summer,2012.0,Casual,Basics Men Grey Striped Shirt
9168,Men,Apparel,Bottomwear,Jeans,Blue,Fall,2011.0,Casual,Locomotive Men Radley Blue Jeans
30355,Men,Apparel,Topwear,Tshirts,Green,Summer,2012.0,Casual,Myntra Men Pista Green T-shirt
12005,Men,Apparel,Topwear,Shirts,Green,Fall,2011.0,Formal,Mark Taylor Men Green Striped Shirt
31287,Men,Apparel,Bottomwear,Shorts,Black,Summer,2012.0,Casual,Puma Men Dazzle Black Shorts
9954,Men,Apparel,Topwear,Tshirts,White,Fall,2011.0,Sports,Nike Men White Polo Tshirts
17577,Men,Apparel,Bottomwear,Trousers,Grey,Fall,2011.0,Casual,Mark Taylor Men Solid Grey Trouser
29278,Men,Apparel,Topwear,Shirts,Blue,Summer,2012.0,Casual,Wrangler Men Aaron Check Blue Shirt
53435,Men,Apparel,Topwear,Jackets,Black,Summer,2012.0,Sports,ADIDAS Men Black Jacket
11680,Men,Apparel,Topwear,Shirts,Red,Fall,2011.0,Casual,Lee Men Check Red Shirts
10752,Men,Apparel,Topwear,Tshirts,White,Fall,2011.0,Sports,Nike Men Hell With White Tshirts
40022,Men,Apparel,Topwear,Tshirts,White,Summer,2012.0,Casual,ADIDAS Men White Polo T-shirt
21227,Men,Apparel,Topwear,Tshirts,Orange,Summer,2012.0,Casual,Basics Men Orange Printed Polo T-shirt
15012,Men,Apparel,Topwear,Jackets,Blue,Fall,2011.0,Sports,ADIDAS Men Solid Blue Jackets
32630,Men,Apparel,Topwear,Tshirts,Grey,Summer,2012.0,Sports,Nike Men Premier Training Grey T-shirt
24755,Men,Apparel,Bottomwear,Jeans,Blue,Summer,2011.0,Casual,Spykar Men Blue Jeans
43495,Men,Apparel,Topwear,Tshirts,Brown,Summer,2012.0,Casual,French Connection Men Brown Printed T-shirt
8288,Men,Apparel,Topwear,Tshirts,Red,Fall,2011.0,Casual,Mr.Men Men's Beet Red T-shirt
12237,Men,Apparel,Topwear,Shirts,Red,Fall,2011.0,Formal,Genesis Men Red Gingham Shirt
19419,Men,Apparel,Bottomwear,Shorts,Black,Fall,2011.0,Casual,Quiksilver Men Black Printed Shorts
31273,Men,Apparel,Topwear,Tshirts,Green,Summer,2012.0,Casual,Puma Men Calonge Graphic Green T-shirt
7006,Men,Apparel,Topwear,Tshirts,Black,Summer,2011.0,Casual,s.Oliver Men's Sound Rebels Black T-shirt
51396,Men,Apparel,Bottomwear,Shorts,Navy Blue,Summer,2012.0,Casual,Myntra Men Navy Blue Check Shorts
8872,Men,Apparel,Topwear,Shirts,Blue,Fall,2011.0,Casual,Mark Taylor Men Blue Striped Shirt
14306,Men,Apparel,Topwear,Sweatshirts,Navy Blue,Fall,2011.0,Casual,ADIDAS Men Printed Navy Blue Sweatshirts
11674,Men,Apparel,Topwear,Shirts,Purple,Fall,2011.0,Casual,Lee Men Check Purple Shirts
13311,Men,Apparel,Topwear,Shirts,Navy Blue,Fall,2011.0,Casual,Gini and Jony Kids Boys Solid Navy Blue Shirts
44220,Men,Apparel,Topwear,Tshirts,Navy Blue,Summer,2012.0,Casual,Nike Men Navy Blue Iniesta Football T-shirt
40680,Men,Apparel,Topwear,Tshirts,Red,Summer,2012.0,Casual,Lee Men Red Brad T-shirt
31425,Men,Apparel,Bottomwear,Trousers,Grey,Summer,2012.0,Casual,Highlander Men Grey Trousers
26492,Men,Apparel,Topwear,Tshirts,White,Summer,2012.0,Casual,Puma Men Printed White T-shirt
16207,Men,Apparel,Topwear,Sweatshirts,Grey,Fall,2011.0,Casual,Puma Men Cheveron Wording Grey SweatShirt
7650,Men,Apparel,Topwear,Tshirts,Grey,Fall,2011.0,Sports,Puma Men's Ducati One Ups White T-shirt
6782,Men,Apparel,Topwear,Shirts,Blue,Winter,2012.0,Casual,Timberland Men Claremont Green and Blue Check Shirt
28508,Men,Apparel,Topwear,Tshirts,White,Summer,2012.0,Sports,Nike Men Training White T-shirt
54280,Men,Apparel,Topwear,Shirts,Grey,Summer,2012.0,Formal,Black Coffee Men Grey Shirt
7462,Men,Apparel,Topwear,Tshirts,Grey,Summer,2011.0,Casual,Proline Men Grey Printed T-shirt
19841,Men,Apparel,Topwear,Shirts,Grey,Fall,2011.0,Casual,U.S. Polo Assn. Men Check Grey Shirt
46745,Men,Apparel,Bottomwear,Track Pants,Charcoal,Summer,2012.0,Sports,Nike Men Black Track Pants
16035,Men,Apparel,Topwear,Shirts,White,Fall,2011.0,Casual,Highlander Men Check White Shirt
22200,Men,Apparel,Topwear,Tshirts,Grey,Summer,2011.0,Casual,Timberland Men Grey Printed T-Shirt
18993,Men,Apparel,Topwear,Tshirts,Red,Summer,2011.0,Casual,ADIDAS Originals Men Red T-shirt
34365,Men,Apparel,Topwear,Tshirts,Blue,Summer,2012.0,Casual,Myntra Men Blue Jazzy Moves T-shirt
14762,Men,Apparel,Topwear,Shirts,Blue,Fall,2011.0,Formal,Arrow Men Check Blue Shirts
36852,Men,Apparel,Topwear,Shirts,Blue,Winter,2013.0,Casual,Spykar Men Passion Blue Shirt
16469,Men,Apparel,Topwear,Shirts,Black,Fall,2011.0,Casual,Locomotive Men Check Black Shirt
13329,Men,Apparel,Topwear,Shirts,White,Fall,2011.0,Casual,Gini and Jony Kids Boys Printed White Tshirts
14930,Men,Apparel,Topwear,Tshirts,Navy Blue,Fall,2011.0,Casual,Status Quo Men Solid Navy Blue Tshirts
33944,Men,Apparel,Topwear,Tshirts,White,Summer,2012.0,Casual,ADIDAS Men White Striped Polo T-shirt
15688,Men,Apparel,Bottomwear,Trousers,Beige,Fall,2011.0,Casual,Highlander Men Classic Chinos Beige Trousers
41558,Men,Apparel,Topwear,Tshirts,Green,Winter,2012.0,Casual,Probase Men Green Polo T-shirt
8412,Men,Apparel,Topwear,Tshirts,Blue,Fall,2011.0,Sports,ADIDAS Men Blue Polo Tshirts
18197,Men,Apparel,Bottomwear,Trousers,Navy Blue,Fall,2011.0,Casual,Highlander Men Solid Navy Blue Trouser
2128,Men,Apparel,Topwear,Shirts,White,Spring,2011.0,Casual,Basics Men Red & White Slim Fit Shirt
48421,Men,Apparel,Topwear,Tshirts,Grey Melange,Summer,2012.0,Casual,French Connection Men Grey Printed T-shirt
24309,Men,Apparel,Bottomwear,Shorts,Grey,Fall,2011.0,Casual,ADIDAS Men Grey Shorts
4825,Men,Apparel,Bottomwear,Track Pants,Grey,Summer,2011.0,Sports,ADIDAS Men's Woven Lead White Track Pant
1759,Men,Apparel,Topwear,Tshirts,Grey,Fall,2010.0,Sports,Lotto Men Epic Grey T-shirt
9534,Men,Apparel,Topwear,Tshirts,Black,Summer,2011.0,Sports,Nike Men Ast 90ss Graphic Black T-Shirts
17917,Men,Apparel,Topwear,Sweatshirts,Purple,Fall,2011.0,Sports,Nike Men Purple Sweatshirt
37148,Men,Apparel,Topwear,Tshirts,Grey,Summer,2016.0,Casual,Campbell Men Pack of 3 T-shirt
6924,Men,Apparel,Topwear,Tshirts,Black,Summer,2011.0,Sports,Asics Men's Running Graphic Black Grey T-shirt
6118,Men,Apparel,Topwear,Tshirts,Grey,Summer,2011.0,Casual,UCB Men's Roundneck Striper Live In Dark Green Grey T-shirt
12801,Men,Apparel,Topwear,Tshirts,Red,Fall,2011.0,Sports,Nike Men Red Manchester United Jersey
26806,Men,Apparel,Bottomwear,Trousers,Charcoal,Summer,2013.0,Formal,Arrow Men Charcoal Flat Front Trousers
59305,Men,Apparel,Topwear,Shirts,Blue,Fall,2012.0,Casual,U.S. Polo Assn. Denim Co. Men Red & Navy Blue Shirt
12492,Men,Apparel,Topwear,Shirts,Blue,Fall,2011.0,Formal,John Miller Men Solid Blue Shirts
2117,Men,Apparel,Bottomwear,Shorts,Grey,Fall,2010.0,Sports,ADIDAS Men Grey  Capris
22207,Men,Apparel,Topwear,Shirts,Pink,Summer,2012.0,Casual,Timberland Men Pink Shirt
16032,Men,Apparel,Topwear,Shirts,Grey,Fall,2011.0,Casual,Highlander Men Check Grey Shirt
7465,Men,Apparel,Topwear,Tshirts,Navy Blue,Summer,2011.0,Casual,Proline Men Navy Striped Polo T-shirt
19846,Men,Apparel,Topwear,Shirts,Navy Blue,Fall,2011.0,Casual,U.S. Polo Assn. Men Striped Navy Blue Shirt
34362,Men,Apparel,Topwear,Tshirts,Blue,Summer,2012.0,Casual,Myntra Men Blue Dying To Ride T-shirt
18994,Men,Apparel,Topwear,Tshirts,Black,Summer,2011.0,Casual,ADIDAS Originals Men G Tag Black Tshirt
14765,Men,Apparel,Topwear,Shirts,Navy Blue,Fall,2011.0,Formal,Arrow Men Stripes Navy Blue Slim Fit Shirt
44829,Men,Apparel,Topwear,Tshirts,White,Summer,2012.0,Casual,Puma Men White Graphic T-shirt
5100,Men,Apparel,Topwear,Tshirts,Yellow,Summer,2011.0,Casual,Wrangler Men's Cowboy Color Yellow T-shirt
26495,Men,Apparel,Topwear,Tshirts,Black,Summer,2012.0,Casual,Puma Men Shinjuku Black T-shirt
31422,Men,Apparel,Bottomwear,Shorts,White,Summer,2012.0,Sports,Nike Men White Shorts
2325,Men,Apparel,Topwear,Tshirts,Black,Fall,2010.0,Casual,Reebok Men's Star Black Polo T-shirt
16200,Men,Apparel,Topwear,Tshirts,Grey,Fall,2011.0,Casual,Puma Men Polo Grey TShirt
6785,Men,Apparel,Topwear,Jackets,Red,Summer,2011.0,Casual,Timberland Men Falmouth Cycling Jac Red Jacket
54889,Men,Apparel,Topwear,Sweatshirts,Olive,Summer,2012.0,Casual,Do u speak green Men Olive Sweatshirt
14133,Men,Apparel,Topwear,Tshirts,Grey,Fall,2011.0,Sports,Nike Men Printed Grey Tshirts
13316,Men,Apparel,Topwear,Shirts,Blue,Fall,2011.0,Casual,Gini and Jony Kids Boys Check Blue Shirts
31046,Men,Apparel,Topwear,Shirts,Yellow,Summer,2012.0,Casual,Arrow Sport Men Check Yellow Shirt
16664,Men,Apparel,Topwear,Sweatshirts,Black,Fall,2011.0,Casual,Fila Men Squid Black Sweater
31274,Men,Apparel,Topwear,Tshirts,Navy Blue,Summer,2012.0,Casual,Puma Men Calogne Graphic Navy Blue T-shirt
16456,Men,Apparel,Topwear,Shirts,Blue,Fall,2011.0,Casual,Locomotive Men Check Blue Shirt
14301,Men,Apparel,Topwear,Tshirts,Grey,Fall,2011.0,Casual,Classic Polo Men Printed pack of 3 Tshirts
11673,Men,Apparel,Topwear,Shirts,Red,Fall,2011.0,Casual,Lee Men Red Check Shirt
15015,Men,Apparel,Topwear,Sweatshirts,Black,Fall,2011.0,Sports,ADIDAS Men Printed Black Sweatshirts
43492,Men,Apparel,Topwear,Tshirts,Off White,Summer,2012.0,Casual,French Connection Men Off White T-shirt
12230,Men,Apparel,Topwear,Shirts,Pink,Fall,2011.0,Formal,Genesis Pink & White Striped Formal Shirt
30352,Men,Apparel,Topwear,Tshirts,Pink,Summer,2012.0,Casual,Myntra Men Noise Vision Pink T-shirt
31280,Men,Apparel,Topwear,Tshirts,Red,Summer,2012.0,Sports,PUMA Red Bonn Graphic Print T-shirt
26237,Men,Apparel,Topwear,Tshirts,Orange,Summer,2012.0,Casual,Proline Men Orange Printed T-shirt
9953,Men,Apparel,Topwear,Tshirts,Yellow,Fall,2011.0,Sports,Nike Men CBF H/A SS RE Yellow Jersey
17570,Men,Apparel,Topwear,Shirts,Green,Fall,2011.0,Formal,Mark Taylor Men Green & White Striped Shirt
8881,Men,Apparel,Bottomwear,Trousers,Navy Blue,Summer,2011.0,Casual,Scullers Men Scul Navy Blue Trousers
53432,Men,Apparel,Topwear,Tshirts,Navy Blue,Summer,2012.0,Sports,ADIDAS Men Navy Blue Jersey
40025,Men,Apparel,Bottomwear,Track Pants,Black,Summer,2012.0,Casual,ADIDAS Men Black Track Pants
17928,Men,Apparel,Bottomwear,Track Pants,Black,Fall,2011.0,Sports,Nike Men Casual Black Track Pant
30736,Men,Apparel,Bottomwear,Churidar,White,Summer,2012.0,Ethnic,Fabindia Men White Churidar
6543,Men,Apparel,Topwear,Tshirts,Black,Summer,2011.0,Sports,Nike Men's Training Black White T-shirt
15643,Men,Apparel,Bottomwear,Track Pants,Black,Fall,2011.0,Sports,Nike Men AS Team Woven Black Track Pants
1766,Men,Apparel,Topwear,Tshirts,Blue,Fall,2010.0,Casual,Inesis Men Blue Polo T-shirt
41593,Men,Apparel,Topwear,Shirts,Beige,Summer,2012.0,Casual,Basics Men Beige Striped Shirt
37721,Men,Apparel,Topwear,Tshirts,Red,Summer,2012.0,Casual,John Players Men Polo Red T-shirt
53264,Men,Apparel,Topwear,Shirts,Black,Summer,2012.0,Casual,Locomotive Men Black Shirt
24336,Men,Apparel,Topwear,Tshirts,Blue,Fall,2011.0,Casual,ADIDAS Men Blue T-shirt
12654,Men,Apparel,Topwear,Tshirts,Purple,Fall,2011.0,Casual,Probase Men Printed Royal Blue Tshirts
3203,Men,Apparel,Topwear,Tshirts,Red,Summer,2011.0,Casual,Tantra Men's Who Are You Red T-shirt
13786,Men,Apparel,Topwear,Sweaters,Grey,Fall,2011.0,Casual,Proline Grey Sweater with Knitted Stripes
6771,Men,Apparel,Topwear,Shirts,Pink,Summer,2011.0,Casual,Timberland Men Claremont Popl Pink Shirt
31476,Men,Apparel,Bottomwear,Trousers,Charcoal,Summer,2012.0,Casual,Black Coffee Men Striped Charcoal Trousers
43056,Men,Apparel,Topwear,Tshirts,Black,Summer,2012.0,Casual,Nike Men Black Speed Cricket T-shirt
11071,Men,Apparel,Topwear,Shirts,Black,Fall,2011.0,Casual,Scullers Men Check Black Shirts
41701,Men,Apparel,Bottomwear,Shorts,Navy Blue,Summer,2012.0,Casual,DC Comics Men Navy Blue Printed Shorts
37781,Men,Apparel,Topwear,Shirts,White,Summer,2012.0,Casual,John Players Men White Striped Shirt
4086,Men,Apparel,Topwear,Tshirts,Navy Blue,Summer,2011.0,Casual,Classic Polo Men's Navy With White Stripes T-shirt
14731,Men,Apparel,Topwear,Shirts,Lavender,Fall,2011.0,Formal,Arrow Men Solid Lavender Shirts
19812,Men,Apparel,Topwear,Sweatshirts,Navy Blue,Fall,2011.0,Casual,U.S. Polo Assn. Men Solid Navy Blue Sweatshirt
16066,Men,Apparel,Bottomwear,Trousers,Black,Fall,2011.0,Casual,Highlander Men Solid Black Trouser
34336,Men,Apparel,Topwear,Tshirts,Purple,Summer,2012.0,Casual,Myntra Men Love Only Purple T-shirt
31644,Men,Apparel,Topwear,Shirts,Black,Summer,2012.0,Formal,Indigo Nation Men Black Shirt
2143,Men,Apparel,Topwear,Tshirts,Navy Blue,Spring,2011.0,Casual,Basics Men Blue Striped Polo T-shirt
30796,Men,Apparel,Topwear,Shirts,Maroon,Summer,2012.0,Ethnic,Fabindia Men Striped Maroon Shirt
40085,Men,Apparel,Bottomwear,Shorts,White,Winter,2014.0,Casual,ADIDAS Men White Chelsea Shorts
20160,Men,Apparel,Topwear,Shirts,Grey,Fall,2011.0,Casual,Wrangler Men Dirt Rider Grey Shirt
8821,Men,Apparel,Topwear,Shirts,White,Fall,2011.0,Casual,Spykar Men Ranger Front Graphic White Shirts
16402,Men,Apparel,Topwear,Shirts,Blue,Fall,2011.0,Casual,Levis Men Check Blue Shirt
26297,Men,Apparel,Topwear,Tshirts,Purple,Summer,2012.0,Casual,Proline Men Purple Striped Polo T-shirt
22405,Men,Apparel,Topwear,Shirts,White,Fall,2011.0,Casual,Mark Taylor Men Striped White Shirt
16630,Men,Apparel,Topwear,Tshirts,Black,Summer,2016.0,Casual,Facit Men Smart Black Tshirt
12290,Men,Apparel,Bottomwear,Trousers,Black,Fall,2011.0,Formal,Genesis Men Solid Black Trousers
33583,Men,Apparel,Topwear,Tshirts,Green,Summer,2012.0,Casual,Wrangler Men Triple Striped Green T-shirt
20194,Men,Apparel,Topwear,Sweatshirts,White,Fall,2011.0,Casual,Wrangler Men Seattle Embro White Sweatshirt
46386,Men,Apparel,Topwear,Tshirts,Blue,Summer,2012.0,Casual,ADIDAS Men Blue  Printed T-shirt
51331,Men,Apparel,Topwear,Rain Jacket,Black,Summer,2015.0,Casual,Wildcraft Men Black Rain Cheater'13
30306,Men,Apparel,Topwear,Tshirts,Off White,Summer,2012.0,Casual,Myntra Men Blue Bird Off White T-shirt
26263,Men,Apparel,Topwear,Tshirts,Blue,Summer,2013.0,Casual,Proline Men Blue Polo T-Shirt
29019,Men,Apparel,Topwear,Tshirts,Navy Blue,Summer,2012.0,Casual,ADIDAS Men Color Block Navy Blue T-shirt
7293,Men,Apparel,Topwear,Tshirts,Green,Fall,2011.0,Casual,Mickey Men's Mouse Butter Comic Duck Green T-shirt
27183,Men,Apparel,Bottomwear,Trousers,Charcoal,Summer,2012.0,Formal,Mark Taylor Men Striped Charcoal Trousers
30134,Men,Apparel,Topwear,Tshirts,Orange,Summer,2012.0,Casual,Flying Machine Men Printed Orange T-shirt
9309,Men,Apparel,Topwear,Tshirts,Navy Blue,Fall,2011.0,Casual,Indian Terrain Men Rico Navy Blue T-shirt
12264,Men,Apparel,Topwear,Shirts,Grey,Fall,2011.0,Formal,Genesis Men Grey Shirt
41391,Men,Apparel,Topwear,Shirts,Brown,Summer,2012.0,Casual,Wrangler Men Brown Check Shirt
1164,Men,Apparel,Topwear,Tshirts,Blue,Winter,2015.0,Sports,Nike Men Blue T20 Indian Cricket Jersey
4416,Men,Apparel,Topwear,Tshirts,White,Summer,2011.0,Casual,Free Authority Men's Melting 3 Colors Records White T-shirt
15041,Men,Apparel,Topwear,Sweatshirts,Grey,Fall,2011.0,Casual,ADIDAS Men Printed Grey Sweatshirts
30550,Men,Apparel,Topwear,Tshirts,Blue,Fall,2011.0,Casual,Inkfruit Men Printed Blue T-shirt
11085,Men,Apparel,Topwear,Shirts,Green,Fall,2011.0,Casual,Scullers Men Check Green Shirts
44287,Men,Apparel,Topwear,Tshirts,Purple,Summer,2012.0,Casual,Indian Terrain Men Purple T-shirt
37775,Men,Apparel,Topwear,Shirts,Blue,Summer,2012.0,Casual,John Players Men Blue & Orange Check Shirt
24150,Men,Apparel,Topwear,Tshirts,Red,Spring,2012.0,Casual,ADIDAS Men Red T-shirt
44889,Men,Apparel,Topwear,Tshirts,Black,Summer,2012.0,Casual,Puma Men Black and Grey Rugby Polo T-shirt
4240,Men,Apparel,Topwear,Tshirts,Green,Summer,2011.0,Casual,Probase Men's Musical figures Green T-shirt
3859,Men,Apparel,Topwear,Tshirts,White,Summer,2011.0,Casual,Ed Hardy Men's White Skull Rider T-shirt
18934,Men,Apparel,Topwear,Tshirts,Purple,Fall,2011.0,Casual,Levi'si Men Embroidery Purple Tshirt
30762,Men,Apparel,Topwear,Kurtas,Olive,Summer,2012.0,Ethnic,Fabindia Men Printed Olive Kurta
38392,Men,Apparel,Topwear,Tshirts,Blue,Summer,2012.0,Sports,ADIDAS Mumbai Indians Men Blue Match Jersey
44628,Men,Apparel,Topwear,Tshirts,Grey,Summer,2012.0,Sports,Nike Men Grey Training T-shirt
27148,Men,Apparel,Topwear,Shirts,Grey,Summer,2012.0,Formal,Mark Taylor Men Striped Grey Shirt
22608,Men,Apparel,Topwear,Jackets,Navy Blue,Fall,2011.0,Sports,Nike Men Solid Navy Blue Jacket
6984,Men,Apparel,Topwear,Tshirts,Purple,Summer,2011.0,Casual,s.Oliver Men's Polo Black Stripe Purple T-shirt
19475,Men,Apparel,Topwear,Sweatshirts,Navy Blue,Summer,2012.0,Casual,Quiksilver Men Navy Blue Nautical Sweatshirt
7856,Men,Apparel,Topwear,Tshirts,Teal,Fall,2011.0,Casual,Proline Men Teal Blue Striped Polo T-shirt
8022,Men,Apparel,Bottomwear,Track Pants,Navy Blue,Fall,2011.0,Sports,Fila Men's Single Tipped Woven Navy White Track Pant
33548,Men,Apparel,Topwear,Shirts,Blue,Summer,2012.0,Casual,Wrangler Men Nimrod Oxford Blue Shirt
16059,Men,Apparel,Bottomwear,Trousers,Olive,Fall,2011.0,Casual,Highlander Men Solid Olive Trouser
29684,Men,Apparel,Bottomwear,Trousers,Charcoal,Summer,2012.0,Formal,Indigo Nation Men Charcoal Trousers
9594,Men,Apparel,Topwear,Shirts,White,Fall,2011.0,Casual,Scullers Men Scul Red White Shirts
44842,Men,Apparel,Topwear,Tshirts,Black,Summer,2012.0,Casual,Puma Men Black Lifestyle T-shirt
5957,Men,Apparel,Topwear,Shirts,Grey,Summer,2011.0,Casual,Locomotive Men Grey Checked Shirt
28564,Men,Apparel,Topwear,Tshirts,Black,Summer,2012.0,Casual,Nike Men Air Bags Black T-shirt
31449,Men,Apparel,Bottomwear,Shorts,Black,Summer,2012.0,Sports,Nike Men Training Black Shorts
43069,Men,Apparel,Topwear,Tshirts,Grey,Summer,2012.0,Casual,Nike Men Grey Tailwind T-shirt
3866,Men,Apparel,Topwear,Tshirts,Peach,Summer,2011.0,Casual,Wrangler Men's Wild Spirit Striper Peach T-shirt
29670,Men,Apparel,Topwear,Shirts,Black,Summer,2012.0,Casual,Indigo Nation Men Printed Black Shirt
6528,Men,Apparel,Topwear,Tshirts,Red,Summer,2011.0,Sports,Nike Men's Pique Red Polo T-Shirt
17943,Men,Apparel,Topwear,Tshirts,Yellow,Fall,2011.0,Casual,Puma Men Yellow Tshirt
9560,Men,Apparel,Topwear,Tshirts,White,Summer,2011.0,Sports,Nike Men Tmtsc White T-Shirts
53801,Men,Apparel,Topwear,Tshirts,Green,Summer,2012.0,Casual,Puma Men Green T-shirt
11288,Men,Apparel,Bottomwear,Jeans,,Fall,2016.0,Casual,Wrangler Men Blue Texas Jeans
15628,Men,Apparel,Topwear,Sweatshirts,Black,Fall,2011.0,Casual,Nike Men AS Squad FT FZ Hoody Black Sweatshirt
4871,Men,Apparel,Topwear,Tshirts,Red,Summer,2016.0,Casual,Levis Kids Boy's Dawson Red Kidswear
23178,Men,Apparel,Topwear,Tshirts,Yellow,Fall,2011.0,Casual,Mark Taylor Men Yellow Printed T-shirt
3268,Men,Apparel,Topwear,Tshirts,Grey,Summer,2011.0,Casual,Guerrilla Men's Judgement Day Grey T-shirt
18305,Men,Apparel,Topwear,Shirts,Pink,Summer,2011.0,Casual,Wills Lifestyle Men Striped Pink Shirt
9752,Men,Apparel,Topwear,Shirts,Grey,Fall,2011.0,Smart Casual,Indian Terrain Men Grey & White Checked Linen Modern Fit Smart-Casual Shirt
14990,Men,Apparel,Topwear,Sweaters,Black,Fall,2011.0,Casual,ADIDAS Men Solid Black Sweaters
4429,Men,Apparel,Topwear,Tshirts,Maroon,Summer,2011.0,Casual,Wrangler Men's Rodeo Striper Polo Maroon T-shirt
17729,Men,Apparel,Topwear,Shirts,Grey,Fall,2011.0,Casual,Reid & Taylor Men Check Grey Shirt
29026,Men,Apparel,Topwear,Tshirts,Maroon,Summer,2012.0,Sports,ADIDAS Men Villa Maroon T-shirt
13389,Men,Apparel,Topwear,Shirts,Green,Summer,2011.0,Casual,United Colors of Benetton Men Check Green Shirts
9938,Men,Apparel,Topwear,Tshirts,Red,Fall,2011.0,Casual,Probase Men League Red Tshirts
30339,Men,Apparel,Topwear,Tshirts,Red,Summer,2012.0,Casual,Myntra Men Mere Pass Maal Hai Red T-shirt
19481,Men,Apparel,Bottomwear,Shorts,Black,Summer,2012.0,Casual,Quiksilver Men Striped Black Shorts
38154,Men,Apparel,Topwear,Jackets,Black,Summer,2012.0,Casual,Wildcraft Men Black Husky Jacket
4247,Men,Apparel,Topwear,Tshirts,Maroon,Summer,2011.0,Casual,Probase Men's I'M So Broke Maroon T-shirt
15610,Men,Apparel,Bottomwear,Shorts,Black,Fall,2011.0,Sports,Nike Men Trainng Black Shorts
29648,Men,Apparel,Topwear,Shirts,Grey,Summer,2012.0,Formal,Indigo Nation Men Grey Striped Shirt
18933,Men,Apparel,Topwear,Tshirts,Black,Fall,2011.0,Casual,Levi's Men Embroidery Black Tshirt
3062,Men,Apparel,Topwear,Tshirts,Blue,Summer,2011.0,Casual,Tantra Men's Vegetarian Blue T-shirt
30765,Men,Apparel,Topwear,Kurtas,Beige,Summer,2012.0,Ethnic,Fabindia Men Beige Chikankari Silk Kurta
9558,Men,Apparel,Topwear,Tshirts,Black,Fall,2011.0,Sports,Nike Men Black Black Tshirts
6722,Men,Apparel,Topwear,Tshirts,Black,Summer,2011.0,Casual,Locomotive Men's Fateeion Black Blue T-shirt
32200,Men,Apparel,Topwear,Kurtas,Red,Summer,2012.0,Ethnic,Fabindia Men Printed Red Kurta
11082,Men,Apparel,Topwear,Shirts,Red,Fall,2011.0,Casual,Scullers Men Check Red Shirt
37772,Men,Apparel,Topwear,Shirts,Blue,Summer,2012.0,Casual,John Players Men Gingham Blue Shirt
7294,Men,Apparel,Topwear,Tshirts,Yellow,Summer,2011.0,Casual,Free Authority Men's Tattoo Gun Lime Yellow T-shirt
27184,Men,Apparel,Bottomwear,Trousers,Black,Summer,2012.0,Formal,Mark Taylor Men Striped Black Trousers
12263,Men,Apparel,Topwear,Shirts,Red,Winter,2011.0,Formal,Genesis Red Striped Formal Shirt
26056,Men,Apparel,Topwear,Shirts,Black,Summer,2012.0,Formal,John Miller Men Check Black Shirt
41396,Men,Apparel,Topwear,Shirts,Green,Summer,2012.0,Casual,Wrangler Men Green & Blue Check Shirt
1163,Men,Apparel,Topwear,Tshirts,Blue,Summer,2011.0,Sports,Nike Sahara Team India Fanwear Round Neck Jersey
4411,Men,Apparel,Topwear,Tshirts,Grey,Summer,2011.0,Casual,Beatles Men's The Beatles Brick Road Grey Violet T-shirt
32456,Men,Apparel,Bottomwear,Track Pants,Black,Spring,2013.0,Sports,ADIDAS Men Black Track Pants
20193,Men,Apparel,Topwear,Sweatshirts,Grey,Fall,2011.0,Casual,Wrangler Men Seattle Embro Grey Sweatshirt
6174,Men,Apparel,Topwear,Tshirts,White,Summer,2011.0,Casual,Lee Men's Striper White Green T-shirt
9900,Men,Apparel,Bottomwear,Jeans,Blue,Fall,2011.0,Casual,Spykar Men Actif Fit Low Waist Blue Jeans
46381,Men,Apparel,Topwear,Tshirts,Black,Summer,2012.0,Casual,ADIDAS Men Black Printed T-shirt
30301,Men,Apparel,Topwear,Tshirts,Cream,Summer,2012.0,Casual,Myntra Men Back To The 70s Cream T-shirt
26264,Men,Apparel,Topwear,Tshirts,Black,Summer,2012.0,Casual,Proline Men Black T-Shirt
28138,Men,Apparel,Bottomwear,Shorts,Black,Summer,2016.0,Casual,Jockey SPORT Men Black Knit Sport Shorts 9411
16637,Men,Apparel,Topwear,Tshirts,Navy Blue,Summer,2016.0,Casual,Facit Men Smart Navy Blue Tshirt
22402,Men,Apparel,Topwear,Shirts,White,Fall,2011.0,Casual,Mark Taylor Men Striped White Shirt
27170,Men,Apparel,Topwear,Shirts,White,Summer,2012.0,Formal,Mark Taylor Men Striped White Shirt
12297,Men,Apparel,Topwear,Shirts,Blue,Fall,2011.0,Formal,Genesis Men Stripes Blue Shirts
31015,Men,Apparel,Topwear,Shirts,White,Winter,2012.0,Formal,Arrow Men White and Blue Striped Shirt
20355,Men,Apparel,Topwear,Shirts,Navy Blue,Fall,2011.0,Casual,Spykar Men Solid Navy Blue Shirt
33570,Men,Apparel,Topwear,Tshirts,Grey,Summer,2012.0,Casual,Wrangler Men Grey Polo T-shirt
40082,Men,Apparel,Bottomwear,Shorts,Navy Blue,Winter,2014.0,Casual,ADIDAS Men Navy Blue Short
20167,Men,Apparel,Topwear,Shirts,Blue,Fall,2011.0,Casual,Wrangler Men Multi Blue Shirt
8826,Men,Apparel,Topwear,Shirts,White,Fall,2011.0,Casual,Spykar Men Ranger White Mustard Stripe Shirts
16405,Men,Apparel,Topwear,Shirts,Navy Blue,Fall,2011.0,Casual,Levis Men Check Navy Blue Shirts
14736,Men,Apparel,Topwear,Shirts,White,Fall,2011.0,Formal,Arrow Men Solid White Shirts
16061,Men,Apparel,Bottomwear,Trousers,Olive,Fall,2011.0,Casual,Highlander Men Solid Olive Trouser
19815,Men,Apparel,Topwear,Sweatshirts,Green,Fall,2011.0,Casual,U.S. Polo Assn. Men Solid Green Sweatshirt
7436,Men,Apparel,Topwear,Tshirts,Beige,Summer,2011.0,Casual,Proline Men Green Polo T-shirt
