id,gender,masterCategory,subCategory,articleType,baseColour,season,year,usage,productDisplayName
2850,Men,Apparel,Topwear,Tshirts,Grey,Summer,2011.0,Casual,Mr.Men Men's Mr.Funny Grey T-shirt
34219,Men,Apparel,Topwear,Tshirts,Sea Green,Summer,2013.0,Casual,Proline Sea Green Polo T-shirt
3982,Men,Apparel,Topwear,Tshirts,Grey,Summer,2011.0,Casual,Mr.Men Men's Wassup Grey T-shirt
8556,Men,Apparel,Topwear,Tshirts,Orange,Fall,2011.0,Casual,Probase Men Speed Ski the Best performer Orange Tshirts
28857,Men,Apparel,Topwear,Tshirts,Navy Blue,Summer,2012.0,Casual,Proline Men Navy Blue T-shirt
13216,Men,Apparel,Topwear,Shirts,White,Fall,2011.0,Casual,Palm Tree Kids Boys Solid White Shirts
3793,Men,Apparel,Topwear,Tshirts,Blue,Summer,2011.0,Casual,Basics Men Blue & Yellow Striped Polo T-shirt
14033,Men,Apparel,Topwear,Shirts,Green,Fall,2011.0,Casual,Flying Machine Men Check Green Shirts
25774,Men,Apparel,Topwear,Suspenders,Beige,Summer,2012.0,Formal,Lino Perros Men Beige Suspenders
11773,Men,Apparel,Topwear,Tshirts,Orange,Fall,2011.0,Casual,Lee Men Printed Orange Tshirts
25546,Men,Apparel,Topwear,Tshirts,White,Summer,2012.0,Casual,Wrangler Men Rugged Goods White T-shirt
27211,Men,Apparel,Topwear,Shirts,Purple,Summer,2012.0,Casual,Doodle Kids Boy Check Purple Shirt
8149,Men,Apparel,Topwear,Shirts,Blue,Summer,2011.0,Casual,Highlander Men Blue Checked Hadley Slim Fit Shirt
16556,Men,Apparel,Topwear,Sweatshirts,Grey,Fall,2011.0,Casual,Basics Men Grey Printed Sweatshirt
14665,Men,Apparel,Topwear,Shirts,White,Fall,2011.0,Casual,Basics Men White Slim Fit Checked Shirt
5232,Men,Apparel,Topwear,Tshirts,Maroon,Summer,2011.0,Casual,Classic Polo Men's Cari Maroon Polo T-shirt
52070,Men,Apparel,Topwear,Tshirts,Green,Summer,2012.0,Casual,Myntra Men Green T-shirt
44929,Men,Apparel,Topwear,Tshirts,Black,Summer,2012.0,Casual,Jack & Jones Men Black T-shirt
13440,Men,Apparel,Topwear,Tshirts,Grey,Summer,2011.0,Casual,United Colors of Benetton Men Printed Grey Tshirts
7565,Men,Apparel,Topwear,Tshirts,Grey,Summer,2011.0,Sports,Nike Men's Grey Polo T-Shirt
22909,Men,Apparel,Topwear,Tshirts,Brown,Fall,2011.0,Casual,Mark Taylor Men Brown Printed T-shirt
15585,Men,Apparel,Topwear,Sweatshirts,Blue,Fall,2011.0,Casual,Proline Men Blue Printed Sweatshirt
14691,Men,Apparel,Bottomwear,Trousers,Tan,Fall,2011.0,Casual,Basics Men Tan Trousers
3131,Men,Apparel,Topwear,Tshirts,Brown,Fall,2010.0,Casual,DUSG Men's Periyar Cotton Melange T-shirt
7591,Men,Apparel,Topwear,Tshirts,White,Summer,2011.0,Sports,Nike Men's As Tennis Mas T-shirt
18860,Men,Apparel,Topwear,Tshirts,White,Fall,2011.0,Casual,Puma Men White Grafitti T-shirt
9639,Men,Apparel,Topwear,Shirts,Blue,Fall,2011.0,Casual,Indigo Nation Men Checks Blue Shirts
26105,Men,Apparel,Topwear,Shirts,Purple,Summer,2012.0,Formal,John Miller Men Striped Purple Shirt
3767,Men,Apparel,Topwear,Tshirts,Blue,Summer,2011.0,Casual,Status Quo Men's Blue Polo T-shirt
6215,Men,Apparel,Topwear,Tshirts,White,Summer,2011.0,Casual,Lee Men's Printed White T-shirt
15115,Men,Apparel,Bottomwear,Trousers,Navy Blue,Fall,2012.0,Formal,Arrow Men TR Finish Navy Blue Trousers
5490,Men,Apparel,Topwear,Tshirts,Grey,Summer,2011.0,Casual,Mr.Men Men's Wave Rider Grey Melange T-shirt
25780,Men,Apparel,Topwear,Suspenders,Blue,Summer,2012.0,Formal,Arrow Men Blue Suspenders
10467,Men,Apparel,Topwear,Tshirts,Navy Blue,Fall,2011.0,Casual,Flying Machine Men Blue Polo Tshirts
15327,Men,Apparel,Topwear,Tshirts,Blue,Fall,2011.0,Casual,Nike Men Stripes Blue Tshirts
38803,Men,Apparel,Topwear,Tshirts,Blue,Summer,2012.0,Casual,Marvel Men Blue Printed T-shirt
44585,Men,Apparel,Bottomwear,Jeans,Black,Summer,2017.0,Casual,Lee Men Black Skinny Fit Jeans
59834,Men,Apparel,Topwear,Shirts,Navy Blue,Summer,2012.0,Casual,United Colors of Benetton Men Navy Blue Shirt
32505,Men,Apparel,Topwear,Shirts,Black,Summer,2012.0,Casual,Scullers Men Black Shirt
6027,Men,Apparel,Topwear,Tshirts,Red,Summer,2011.0,Casual,UCB Men's Big Benetton Red T-shirt
22797,Men,Apparel,Bottomwear,Shorts,Grey,Fall,2011.0,Casual,Manchester United Men Grey Shorts
39770,Men,Apparel,Topwear,Shirts,Green,Summer,2012.0,Casual,Peter England Men Multi Coloured Casual Shirt
8720,Men,Apparel,Topwear,Shirts,Green,Fall,2011.0,Casual,Indigo Nation Men Stripes Green Shirts
7768,Men,Apparel,Topwear,Tshirts,Grey,Summer,2011.0,Sports,Nike Men's As Vapor Ulti Grey Black T-Shirt
16931,Men,Apparel,Topwear,Tshirts,Green,Fall,2011.0,Casual,Spykar Men Solid Green Tshirt
19145,Men,Apparel,Topwear,Sweatshirts,Red,Fall,2011.0,Casual,United Colors of Benetton Men Solid Red SweatShirt
26798,Men,Apparel,Topwear,Shirts,Blue,Summer,2013.0,Formal,Arrow Men Blue Shirt
2028,Men,Apparel,Topwear,Tshirts,Navy Blue,Fall,2010.0,Casual,ADIDAS Men Classic Navy Blue T-shirt
22338,Men,Apparel,Topwear,Tshirts,Black,Fall,2011.0,Casual,John Players Men Solid Black Polo T-Shirt
19979,Men,Apparel,Topwear,Tshirts,Pink,Fall,2011.0,Casual,United Colors of Benetton Men Printed Pink TShirt
6488,Men,Apparel,Topwear,Tshirts,White,Summer,2011.0,Casual,ADIDAS Men's Strip White T-shirt
33078,Men,Apparel,Topwear,Tshirts,Navy Blue,Summer,2012.0,Casual,U.S. Polo Assn. Denim Co. Men Printed Navy Blue T-Shirt
11328,Men,Apparel,Bottomwear,Jeans,Blue,Fall,2011.0,Casual,United Colors of Benetton Men Washed Blue Jeans
48383,Men,Apparel,Bottomwear,Jeans,Black,Summer,2012.0,Casual,French Connection Men Black Jeans
30299,Men,Apparel,Topwear,Tshirts,Off White,Summer,2012.0,Casual,Myntra Men Urban Games Off White T-shirt
7902,Men,Apparel,Bottomwear,Shorts,Brown,Fall,2011.0,Casual,Proline Men Brown & Blue Checked Shorts
13827,Men,Apparel,Topwear,Sweaters,Black,Fall,2011.0,Casual,Indigo Nation Men Solid Black Sweaters
5669,Men,Apparel,Topwear,Tshirts,Brown,Summer,2011.0,Casual,Tantra Men's Page Choco T-shirt
13229,Men,Apparel,Bottomwear,Trousers,Navy Blue,Fall,2011.0,Casual,Palm Tree Kids Boy Solid Navy Blue Trousers
19713,Men,Apparel,Topwear,Shirts,Navy Blue,Summer,2011.0,Casual,United Colors of Benetton Men Navy Blue Check Shirt
8182,Men,Apparel,Topwear,Shirts,White,Summer,2011.0,Casual,Locomotive Men Check Ladomar White Shirts
26308,Men,Apparel,Topwear,Tshirts,Blue,Summer,2013.0,Casual,Proline Men Pack of 3 T-Shirts
56843,Men,Apparel,Bottomwear,Jeans,Blue,Summer,2012.0,Casual,John Players Men Blue Jeans
15318,Men,Apparel,Topwear,Sweatshirts,White,Fall,2011.0,Casual,Nike Men Printed White Sweatshirts
10458,Men,Apparel,Topwear,Tshirts,Green,Fall,2011.0,Casual,Flying Machine Men Green Polo Tshirts
9262,Men,Apparel,Topwear,Shirts,Blue,Fall,2011.0,Formal,Mark Taylor Men Blue Striped Shirt
18635,Men,Apparel,Topwear,Tshirts,Red,Fall,2011.0,Sports,Puma Men Bts Red Tshirts
51854,Men,Apparel,Topwear,Shirts,Blue,Summer,2012.0,Casual,Highlander Men Check Blue Shirt
3758,Men,Apparel,Topwear,Tshirts,Green,Summer,2011.0,Casual,Status Quo Men's Buchanan Street Green T-shirt
10800,Men,Apparel,Topwear,Shirts,Blue,Fall,2011.0,Casual,Wrangler Men Wander Wheels Blue Shirt
39784,Men,Apparel,Topwear,Shirts,Red,Summer,2012.0,Formal,Peter England Men Red Formal Shirt
9606,Men,Apparel,Topwear,Shirts,Yellow,Fall,2011.0,Casual,Indigo Nation Men Price catch Yellow Shirts
54942,Men,Apparel,Topwear,Tshirts,Green,Summer,2012.0,Casual,Do u speak green Men Green T-shirt
30609,Men,Apparel,Bottomwear,Shorts,Black,Spring,2013.0,Sports,Nike Men Black Shorts
32962,Men,Apparel,Topwear,Tshirts,Black,Summer,2012.0,Casual,Angry Birds Men Printed Black T-shirt
59453,Men,Apparel,Topwear,Shirts,Purple,Fall,2012.0,Casual,Arrow New York Men Purple Slim Fit Shirt
15320,Men,Apparel,Topwear,Sweatshirts,Navy Blue,Fall,2011.0,Casual,Nike Men Solid Navy Blue Sweatshirts
44582,Men,Apparel,Bottomwear,Jeans,Navy Blue,Summer,2017.0,Casual,Lee Men Bern Navy Blue Jeans
38804,Men,Apparel,Topwear,Tshirts,Blue,Summer,2012.0,Casual,Joker Men Blue T-shirt
32502,Men,Apparel,Topwear,Shirts,Brown,Summer,2012.0,Formal,Scullers Men Striped Brown Shirt
59833,Men,Apparel,Topwear,Shirts,Green,Summer,2012.0,Casual,United Colors of Benetton Men Green Shirt
11780,Men,Apparel,Topwear,Tshirts,Grey,Fall,2011.0,Casual,Lee Men Printed Grey Tshirts
2480,Men,Apparel,Topwear,Tshirts,Navy Blue,Fall,2010.0,Casual,Puma Men's Foundation Navy Blue Polo T-shirt
23642,Men,Apparel,Topwear,Tshirts,Black,Spring,2013.0,Casual,Jimi Hendrix Men Black Printed T-Shirt
9854,Men,Apparel,Bottomwear,Trousers,Black,Fall,2011.0,Formal,Indian Terrain Men Laffer Black Trousers
6020,Men,Apparel,Topwear,Tshirts,Red,Summer,2011.0,Casual,UCB Men's Roundneck With Sail Racing Print Red T-shirt
12939,Men,Apparel,Topwear,Shirts,Black,Fall,2011.0,Casual,Basics Men Black Slim Fit Checked Shirt
3760,Men,Apparel,Topwear,Tshirts,Black,Summer,2011.0,Casual,Status Quo Men's Harbour Island Black T-shirt
12337,Men,Apparel,Topwear,Tshirts,Navy Blue,Fall,2011.0,Casual,Spykar Men Navy Blue Polo T-Shirts
16797,Men,Apparel,Topwear,Shirts,Black,Fall,2011.0,Casual,Highlander Men Stripes Black Shirt
15112,Men,Apparel,Bottomwear,Trousers,Olive,Fall,2011.0,Formal,Arrow Men TR Finish Olive Trousers
5497,Men,Apparel,Topwear,Tshirts,Pink,Summer,2011.0,Casual,Mr.Men Men's Cool Guy Lilac T-shirt
25787,Men,Apparel,Topwear,Suspenders,Red,Summer,2012.0,Formal,Arrow Men Red Suspenders
10460,Men,Apparel,Topwear,Tshirts,Green,Fall,2011.0,Casual,Flying Machine Green Polo Tshirts
12753,Men,Apparel,Bottomwear,Jeans,Black,Fall,2011.0,Casual,Spykar Men Ep Jeans Black Jeans
10004,Men,Apparel,Bottomwear,Shorts,Grey,Fall,2011.0,Sports,Nike Men As 7 Sw Temp Grey Shorts
14696,Men,Apparel,Bottomwear,Trousers,Olive,Fall,2011.0,Casual,Basics Men Olive Trousers
19189,Men,Apparel,Topwear,Shirts,White,Fall,2011.0,Casual,United Colors of Benetton Men White Shirt
7596,Men,Apparel,Topwear,Tshirts,Yellow,Summer,2011.0,Sports,Nike Men's As Nike Rpeat T-Shirt
18867,Men,Apparel,Bottomwear,Shorts,Grey,Fall,2011.0,Casual,Puma Men Solid Grey Knits Panel Shorts
8718,Men,Apparel,Topwear,Tshirts,Red,Fall,2011.0,Casual,Indigo Nation Men Red Tshirts
20665,Men,Apparel,Topwear,Tshirts,Blue,Fall,2011.0,Casual,Classic Polo Men Striped Blue Tshirt
14662,Men,Apparel,Topwear,Shirts,Blue,Fall,2011.0,Casual,Basics Men Blue Slim Fit Checked Shirt
52077,Men,Apparel,Topwear,Tshirts,Blue,Summer,2012.0,Casual,Myntra Men Blue & Green T-shirt
11310,Men,Apparel,Bottomwear,Jeans,Black,Summer,2016.0,Casual,Wrangler Men Black Texas Jeans
16909,Men,Apparel,Topwear,Sweatshirts,Grey,Fall,2011.0,Casual,Status Quo Men Solid Grey Sweatshirt
2010,Men,Apparel,Topwear,Tshirts,Green,Fall,2010.0,Sports,ADIDAS Mens Classic Green Polo T-shirt
13447,Men,Apparel,Topwear,Tshirts,Pink,Summer,2011.0,Casual,United Colors of Benetton Men Stripes Pink Tshirts
7562,Men,Apparel,Topwear,Tshirts,Black,Summer,2011.0,Sports,Nike Men's As T90 Ss Top T-Shirt
11774,Men,Apparel,Topwear,Tshirts,Green,Fall,2011.0,Casual,Lee Men Printed Green Tshirts
27216,Men,Apparel,Bottomwear,Shorts,Navy Blue,Summer,2012.0,Casual,Doodle Kids Boy  Navy Blue Shorts
19519,Men,Apparel,Topwear,Sweaters,Black,Fall,2011.0,Casual,United Colors of Benetton Men Stripes Black Sweater
16551,Men,Apparel,Topwear,Tshirts,Red,Fall,2011.0,Casual,Basics Men Red Printed T-shirt
28850,Men,Apparel,Topwear,Tshirts,Green,Summer,2013.0,Casual,Proline Men Green Polo T-shirt
3794,Men,Apparel,Topwear,Tshirts,Blue,Summer,2011.0,Casual,Basics Men Blue & White Striped Polo T-shirt
31141,Men,Apparel,Topwear,Shirts,Blue,Summer,2012.0,Formal,John Miller Men Striped Blue Shirt
14034,Men,Apparel,Topwear,Shirts,Blue,Fall,2011.0,Casual,Flying Machine Men Check Blue Shirts
20201,Men,Apparel,Topwear,Sweatshirts,White,Fall,2011.0,Casual,Wrangler Men Seattle Glow White Sweatshirt
25773,Men,Apparel,Topwear,Suspenders,Black,Summer,2012.0,Formal,Lino Perros Men Black & Red Suspenders
17810,Men,Apparel,Topwear,Tshirts,Multi,Fall,2011.0,Casual,Chhota Bheem Kids Boy Chhota Bheem and Krishna Multi Tshirt
18858,Men,Apparel,Topwear,Tshirts,Red,Fall,2011.0,Casual,Puma Men Generation Red Polo Tshirt
59454,Men,Apparel,Topwear,Shirts,Black,Fall,2012.0,Formal,Arrow New York Men Black Check Shirt
10807,Men,Apparel,Topwear,Shirts,Black,Fall,2011.0,Casual,Wrangler Men Stampede Printed Stripe Black Shirts
39783,Men,Apparel,Topwear,Shirts,Red,Summer,2012.0,Formal,Peter England Men Maroon Formal Shirt
9601,Men,Apparel,Topwear,Shirts,Blue,Fall,2011.0,Casual,Scullers Men Scul Blue White Shirts
54945,Men,Apparel,Topwear,Tshirts,Cream,Summer,2012.0,Casual,Do u speak green Men Cream T-Shirt
53738,Men,Apparel,Bottomwear,Track Pants,White,Summer,2012.0,Casual,ADIDAS Men White Track Pant
18632,Men,Apparel,Topwear,Tshirts,Red,Fall,2011.0,Casual,Puma Men GP Speed Red Tshirts
9265,Men,Apparel,Topwear,Shirts,Black,Fall,2011.0,Casual,Scullers Men Scul Black Shirts
48370,Men,Apparel,Topwear,Shirts,Brown,Summer,2012.0,Casual,French Connection Men Brown & Beige Shirt
8185,Men,Apparel,Topwear,Shirts,Grey,Summer,2011.0,Casual,Locomotive Men Check Lafeu Grey Shirts
4748,Men,Apparel,Topwear,Tshirts,Green,Summer,2011.0,Sports,ADIDAS Men's Perf Str Polo White Green T-Shirt
56844,Men,Apparel,Bottomwear,Jeans,Blue,Summer,2012.0,Casual,John Players Men Blue Jeans
2679,Men,Apparel,Topwear,Tshirts,Black,Summer,2011.0,Casual,Inkfruit Men's You Are Being Black T-shirt
19714,Men,Apparel,Topwear,Shirts,Purple,Summer,2011.0,Casual,United Colors of Benetton Men Check Purple Shirt
22569,Men,Apparel,Topwear,Shirts,Blue,Summer,2011.0,Casual,Highlander Men Check Blue Shirt
48384,Men,Apparel,Bottomwear,Jeans,Blue,Summer,2012.0,Casual,French Connection Men Blue Jeans
19526,Men,Apparel,Topwear,Sweaters,Black,Summer,2011.0,Casual,United Colors of Benetton Men Striped Black Sweater
7905,Men,Apparel,Topwear,Tshirts,Green,Fall,2011.0,Casual,Proline Men Green Polo T-shirt
44911,Men,Apparel,Bottomwear,Tracksuits,Black,Summer,2012.0,Casual,Puma Men Black Logo Woven Tracksuit
58740,Men,Apparel,Topwear,Tshirts,Pink,Fall,2012.0,Casual,Puma Men Pink T-shirt
39777,Men,Apparel,Topwear,Shirts,Blue,Summer,2012.0,Casual,Peter England Men Blue Casual Shirt
8727,Men,Apparel,Topwear,Shirts,Blue,Fall,2011.0,Casual,Indigo Nation Men Blue Check Shirt
12798,Men,Apparel,Topwear,Tshirts,Navy Blue,Fall,2011.0,Sports,Nike Men Arsenal Navy Blue Jersey
16338,Men,Apparel,Topwear,Shirts,Blue,Fall,2011.0,Formal,Peter England Men Stripes Blue Shirt
10032,Men,Apparel,Topwear,Tshirts,Black,Fall,2011.0,Sports,Nike Men AS FCB Core T Black T-shirts
9608,Men,Apparel,Topwear,Shirts,Green,Fall,2011.0,Casual,Indigo Nation Men Stripes White Shirts
51402,Men,Apparel,Topwear,Shirts,Blue,Summer,2012.0,Casual,Myntra Men Light Blue Shirt
7792,Men,Apparel,Topwear,Tshirts,Grey,Fall,2011.0,Casual,Proline Men Grey Polo T-shirt
30607,Men,Apparel,Bottomwear,Track Pants,Charcoal,Fall,2012.0,Sports,Nike Men Charcoal Track Pants
12557,Men,Apparel,Topwear,Tshirts,Red,Fall,2011.0,Casual,Tantra Men Red Printed T-shirt
3100,Men,Apparel,Topwear,Tshirts,Blue,Summer,2011.0,Casual,Probase Men's Spirit Blue T-shirt
18851,Men,Apparel,Topwear,Tshirts,Red,Fall,2011.0,Casual,Puma Men Head Red Tshirt
19983,Men,Apparel,Topwear,Tshirts,Blue,Fall,2011.0,Casual,United Colors of Benetton Men Blue Striped T-shirt
33082,Men,Apparel,Topwear,Tshirts,Green,Summer,2012.0,Casual,U.S. Polo Assn. Denim Co. Men Green Striped T-Shirt
26306,Men,Apparel,Topwear,Tshirts,Grey,Fall,2013.0,Casual,Proline Men Pack of 3 T-Shirts
9862,Men,Apparel,Topwear,Tshirts,Red,Fall,2011.0,Casual,Status Quo Men Red Polo Tshirts
6016,Men,Apparel,Topwear,Shirts,Purple,Summer,2011.0,Casual,Highlander Men Purple White Checked Shirt
21123,Men,Apparel,Topwear,Sweaters,Purple,Fall,2011.0,Casual,s.Oliver Men Check Purple Sweater
10664,Men,Apparel,Topwear,Tshirts,Yellow,Fall,2011.0,Casual,Doodle Boy Rockstar-sing it Yellow Tshirts
15124,Men,Apparel,Bottomwear,Trousers,Grey,Fall,2011.0,Formal,Arrow Men TR Finish Grey Trousers
10456,Men,Apparel,Topwear,Tshirts,Grey,Fall,2011.0,Casual,Flying Machine Men Grey Polo Tshirts
3756,Men,Apparel,Topwear,Tshirts,Pink,Summer,2011.0,Casual,Status Quo Men's Concerts Mulberry T-shirt
26134,Men,Apparel,Bottomwear,Trousers,Black,Summer,2012.0,Formal,John Miller Men Black Trousers
2684,Men,Apparel,Topwear,Tshirts,Purple,Summer,2011.0,Casual,Inkfruit Men's City Beats Violet T-shirt
22594,Men,Apparel,Topwear,Tshirts,Navy Blue,Fall,2011.0,Sports,Nike Men Navy Blue T-shirt
6224,Men,Apparel,Topwear,Tshirts,Grey,Summer,2011.0,Casual,Lee Men's Tom Grey Melange T-shirt
30297,Men,Apparel,Topwear,Tshirts,Off White,Summer,2012.0,Casual,Myntra Men Grand Sport Off White T-shirt
7130,Men,Apparel,Topwear,Tshirts,White,Fall,2011.0,Casual,Urban Yoga Men's White T-shirt
8944,Men,Apparel,Topwear,Shirts,Blue,Fall,2011.0,Casual,Indigo Nation Men Reversible Bling Blue Shirts
13829,Men,Apparel,Topwear,Sweaters,Purple,Fall,2011.0,Casual,Indigo Nation Men Stripes Purple Sweaters
5667,Men,Apparel,Topwear,Tshirts,Black,Summer,2011.0,Casual,Tantra Men's Gizmo Black T-shirt
10690,Men,Apparel,Topwear,Tshirts,Yellow,Fall,2011.0,Casual,Doodle Boy Mummy daddy me Yellow Tshirts
11742,Men,Apparel,Topwear,Tshirts,Navy Blue,Fall,2011.0,Casual,Lee Men Navy Blue Polo Tshirts
14002,Men,Apparel,Topwear,Tshirts,Navy Blue,Fall,2011.0,Sports,Nike Men Solid Navy Blue Jerseys
24697,Men,Apparel,Topwear,Shirts,Brown,Fall,2011.0,Casual,Probase Men Brown Check Shirt
13227,Men,Apparel,Topwear,Tshirts,Brown,Fall,2011.0,Casual,Palm Tree Kids Boys Printed Brown Tshirts
34405,Men,Apparel,Topwear,Tshirts,Black,Summer,2012.0,Casual,Myntra Men Black Printed T-shirt
11114,Men,Apparel,Topwear,Shirts,Purple,Fall,2011.0,Formal,Indigo Nation Men Check Purple Shirts
33244,Men,Apparel,Topwear,Shirts,Blue,Summer,2012.0,Formal,Arrow Men Blue Slim Fit Shirt
12791,Men,Apparel,Topwear,Tshirts,Red,Fall,2011.0,Sports,Nike Men Manchester United Red Jerseys
16331,Men,Apparel,Topwear,Tshirts,Blue,Fall,2011.0,Casual,Peter England Men Stripes Blue Polo T-Shirt
7766,Men,Apparel,Topwear,Tshirts,Brown,Fall,2011.0,Casual,Inkfruit Men's Phalanx Brown Light Green T-shirt
2026,Men,Apparel,Topwear,Tshirts,Green,Fall,2010.0,Casual,ADIDAS Mens Full Deep Green T-shirt
27644,Men,Apparel,Topwear,Tshirts,Green,Summer,2012.0,Casual,Che Guevara Men Printed Green T-shirt
26796,Men,Apparel,Topwear,Shirts,Blue,Summer,2013.0,Formal,Arrow Men Blue Striped Shirt
34253,Men,Apparel,Bottomwear,Track Pants,Black,Summer,2012.0,Casual,Proline Men Black Track Pants
19977,Men,Apparel,Topwear,Tshirts,White,Fall,2011.0,Casual,United Colors of Benetton Men Printed White Tshirt
7554,Men,Apparel,Topwear,Tshirts,Blue,Summer,2011.0,Sports,Nike Men's As Walkthrough Black-Grey T-shirt
22336,Men,Apparel,Topwear,Tshirts,Grey,Fall,2011.0,Casual,John Players Men Stripes Grey Polo T-Shirt
5203,Men,Apparel,Topwear,Tshirts,Red,Summer,2011.0,Casual,Mickey Men's The Original Red T-shirt
14654,Men,Apparel,Topwear,Tshirts,Blue,Fall,2011.0,Casual,Probase Men Funky Music Aqua Blue Tshirts
44918,Men,Apparel,Bottomwear,Shorts,White,Summer,2012.0,Casual,Puma Men White Shorts
33076,Men,Apparel,Topwear,Tshirts,Orange,Summer,2012.0,Casual,U.S.Polo Assn. Men Orange Striped Polo T-shirt
3769,Men,Apparel,Topwear,Tshirts,Blue,Summer,2011.0,Casual,Status Quo Men's Blue Polo T-shirt
9253,Men,Apparel,Topwear,Shirts,Purple,Fall,2011.0,Formal,Mark Taylor Men Purple Striped Shirt
10469,Men,Apparel,Topwear,Tshirts,Yellow,Fall,2011.0,Casual,Flying Machine Men Yellow Polo Tshirts
15329,Men,Apparel,Topwear,Sweaters,White,Fall,2011.0,Sports,Nike Men Solid White Sweaters
9061,Men,Apparel,Topwear,Shirts,White,Fall,2011.0,Formal,Mark Taylor Men White Striped Shirt
12930,Men,Apparel,Topwear,Tshirts,Navy Blue,Fall,2011.0,Casual,Classic Polo Men Club Navy Blue Tshirts
29371,Men,Apparel,Topwear,Shirts,Blue,Summer,2012.0,Formal,Genesis Men Striped Blue Shirt
22799,Men,Apparel,Topwear,Tshirts,Red,Summer,2012.0,Casual,Locomotive Men Printed Red T-shirt
1668,Men,Apparel,Topwear,Tshirts,Red,Fall,2010.0,Casual,Reebok Men Playdry Full Sleeved T-shirt Red
19180,Men,Apparel,Topwear,Shirts,White,Summer,2011.0,Casual,United Colors of Benetton Men Check White Shirt
12568,Men,Apparel,Topwear,Tshirts,Brown,Fall,2011.0,Casual,Tantra Men Printed Brown T-shirt
9637,Men,Apparel,Topwear,Shirts,Black,Fall,2011.0,Casual,Indigo Nation Men Hot Stepper Black Shirts
10831,Men,Apparel,Topwear,Tshirts,Navy Blue,Fall,2011.0,Casual,Wrangler Men American Music Folk Navy Blue T-Shirts
44927,Men,Apparel,Topwear,Tshirts,Grey,Summer,2012.0,Casual,Jack & Jones Men Grey T-shirt
19174,Men,Apparel,Topwear,Shirts,White,Fall,2011.0,Casual,United Colors of Benetton Men Check White Shirt
16900,Men,Apparel,Topwear,Tshirts,Green,Fall,2011.0,Casual,Status Quo Men Green Polo Tshirt
19948,Men,Apparel,Bottomwear,Shorts,Black,Summer,2011.0,Casual,Puma Men Black Baggy Shorts
13218,Men,Apparel,Topwear,Shirts,White,Fall,2011.0,Casual,Palm Tree Kids Boys Solid White Shirts
28859,Men,Apparel,Topwear,Tshirts,Purple,Summer,2013.0,Casual,Proline Men Purple T-shirt
5658,Men,Apparel,Topwear,Tshirts,Mustard,Summer,2011.0,Casual,Tantra Men Freddie Mustard T-shirt
7933,Men,Apparel,Topwear,Tshirts,Black,Fall,2011.0,Sports,Puma Men's Tech Graphic Black Green T-shirt
8147,Men,Apparel,Topwear,Shirts,Blue,Summer,2011.0,Casual,Highlander Men Blue Checked Hadden Slim Fit Shirt
9095,Men,Apparel,Bottomwear,Shorts,Navy Blue,Fall,2011.0,Sports,ADIDAS Men's Schelse Navy Blue Shorts
13816,Men,Apparel,Topwear,Tshirts,Red,Fall,2011.0,Casual,Proline Pack of 3 Printed T-shirts
26791,Men,Apparel,Topwear,Shirts,Off White,Summer,2013.0,Formal,Arrow Men Off White Slim Fit Shirt
6481,Men,Apparel,Topwear,Tshirts,Black,Summer,2011.0,Casual,ADIDAS Men's Polo Black T-shirt
22331,Men,Apparel,Topwear,Tshirts,Grey,Fall,2011.0,Casual,John Players Men Stripes Grey Polo T-Shirt
7553,Men,Apparel,Bottomwear,Track Pants,Black,Summer,2011.0,Sports,Nike Men's Ope Black Track Pant
14653,Men,Apparel,Topwear,Tshirts,White,Fall,2011.0,Casual,Probase Men Art Jam White Tshirts
5204,Men,Apparel,Topwear,Tshirts,Grey,Summer,2011.0,Casual,Mickey Men's Crew Dark Grey T-shirt
33071,Men,Apparel,Topwear,Tshirts,White,Summer,2012.0,Casual,U.S.Polo Assn. Men White Polo T-shirt
44311,Men,Apparel,Topwear,Shirts,Navy Blue,Summer,2012.0,Casual,Indian Terrain Men Navy Blue Check Shirt
11113,Men,Apparel,Topwear,Shirts,White,Fall,2011.0,Formal,Indigo Nation Men Check White Shirt
33243,Men,Apparel,Topwear,Shirts,White,Summer,2012.0,Formal,Arrow Men Navy Blue Check Shirt
8729,Men,Apparel,Topwear,Shirts,Green,Fall,2011.0,Casual,Indigo Nation Men Checks Blue Shirt
7761,Men,Apparel,Topwear,Tshirts,Navy Blue,Fall,2011.0,Casual,Indigo Nation Men Terrible Things Navy Beige T-shirt
16336,Men,Apparel,Topwear,Shirts,Purple,Fall,2011.0,Formal,Peter England Men Solid Purple Shirt
14005,Men,Apparel,Topwear,Tshirts,Red,Fall,2011.0,Sports,Nike Men Solid Red Jerseys
2677,Men,Apparel,Topwear,Tshirts,Green,Summer,2011.0,Casual,Inkfruit Men's Vespa Green T-shirt
28861,Men,Apparel,Topwear,Tshirts,White,Summer,2013.0,Casual,Proline Men White T-shirt
13220,Men,Apparel,Topwear,Tshirts,Blue,Fall,2011.0,Casual,Palm Tree Kids Boys Printed Blue Tshirts
22567,Men,Apparel,Topwear,Shirts,Blue,Summer,2011.0,Casual,Highlander Men Blue Check Shirt
34402,Men,Apparel,Topwear,Tshirts,Black,Summer,2012.0,Casual,Myntra Men Meltdown Black T-shirt
19528,Men,Apparel,Topwear,Sweaters,Red,Fall,2011.0,Casual,United Colors of Benetton Men Solid Red Sweater
8943,Men,Apparel,Topwear,Shirts,Blue,Fall,2011.0,Casual,Indigo Nation Men Reversible Bling Blue Shirts
7137,Men,Apparel,Bottomwear,Track Pants,Black,Fall,2011.0,Casual,Urban Yoga Men Bottoms Black Yoga Pants
5660,Men,Apparel,Topwear,Tshirts,Navy Blue,Summer,2011.0,Casual,Tantra Men Absolut Bangalore Navy Blue T-shirt
11745,Men,Apparel,Topwear,Tshirts,Red,Summer,2011.0,Casual,Lee Men Red Polo Tshirts
15123,Men,Apparel,Bottomwear,Trousers,Grey,Fall,2011.0,Formal,Arrow Men Solid Grey Trousers
10451,Men,Apparel,Topwear,Tshirts,Blue,Fall,2011.0,Casual,Flying Machine Men Blue Polo Tshirts
26133,Men,Apparel,Bottomwear,Trousers,Grey,Summer,2012.0,Formal,John Miller Men Striped Grey Trousers
3751,Men,Apparel,Topwear,Tshirts,Blue,Summer,2011.0,Casual,Status Quo Men's Ticket To Win Blue T-shirt
2683,Men,Apparel,Topwear,Tshirts,Red,Summer,2011.0,Casual,Inkfruit Men's Red And Black T-shirt
12908,Men,Apparel,Topwear,Shirts,Red,Fall,2011.0,Casual,Spykar Men Check Red Shirts
6011,Men,Apparel,Topwear,Shirts,Purple,Summer,2011.0,Casual,Highlander Men Purple Grey Checked Shirt
9865,Men,Apparel,Topwear,Tshirts,Grey,Fall,2011.0,Casual,Status Quo Men Grey & Blue Striped T-shirt
4746,Men,Apparel,Topwear,Tshirts,Grey,Summer,2011.0,Sports,ADIDAS Men's Lead Grey Polo T-shirt
21124,Men,Apparel,Topwear,Sweaters,Black,Fall,2011.0,Casual,s.Oliver Men Solid Black Sweater
3107,Men,Apparel,Topwear,Tshirts,Black,Summer,2011.0,Casual,Probase Men's Cheap Fast & Easy Black T-shirt
6475,Men,Apparel,Topwear,Tshirts,Navy Blue,Summer,2011.0,Casual,ADIDAS Men's Fit Dark Navy T-shirt
18856,Men,Apparel,Topwear,Tshirts,White,Fall,2011.0,Casual,Puma Men Generation White Polo Tshirt
19984,Men,Apparel,Topwear,Tshirts,White,Fall,2011.0,Casual,United Colors of Benetton Men White Tshirt
33085,Men,Apparel,Topwear,Tshirts,Navy Blue,Summer,2012.0,Casual,U.S. Polo Assn. Denim Co. Men Striped Navy Blue T-Shirt
24032,Men,Apparel,Topwear,Tshirts,Brown,Summer,2012.0,Casual,Locomotive Men Light Brown Printed T-shirt
10809,Men,Apparel,Topwear,Shirts,Black,Fall,2011.0,Casual,Wrangler Men Mark Rodeo Riveted Black Shirts
7795,Men,Apparel,Topwear,Tshirts,Blue,Fall,2011.0,Casual,Proline Men Blue Polo T-shirt
51405,Men,Apparel,Topwear,Shirts,Red,Summer,2012.0,Casual,Myntra Men Red & White Striped Shirt
44578,Men,Apparel,Bottomwear,Jeans,Blue,Summer,2017.0,Casual,Lee Men Blue Party Jeans
36158,Men,Apparel,Topwear,Tshirts,Red,Summer,2012.0,Casual,Status Quo Men Red & Charcoal T-shirt
19517,Men,Apparel,Topwear,Sweaters,Grey,Fall,2011.0,Casual,United Colors of Benetton Men Solid Grey Sweater
7934,Men,Apparel,Topwear,Tshirts,Red,Fall,2011.0,Sports,Puma Men's MC Red Grey T-shirt
27218,Men,Apparel,Bottomwear,Shorts,Blue,Summer,2012.0,Casual,Doodle Kids Boy Printed Blue Shorts
